,Type,SMS
2693,spam,urgent urgent free flight europ give away call b th sept take friend free call claim bannfwflyppm
2694,ham,nice new shirt onli thing wear nudist theme mu
2695,ham,hey sexi bun day word thi morn ym think
2696,ham,whenev see still hook
2697,ham,nope go home go pump petrol lor like go rain soon
2698,ham,use foreign stamp whatev send
2699,spam,lost help
2700,ham,oh babi hous come dont ani new pictur facebook
2701,ham,feb lt gt love u day send di ur valu frnd evn come back u gt marri person u luv u ignor di u lose ur luv evr
2702,ham,hiya sorri nt hav signal nt seen heard neither ha unusu put case get sort hug snog
2703,ham,omw back tampa west palm hear happen
2704,ham,yup alreadi thanx print n hand
2705,spam,freemsg fanci flirt repli date join uk fastest grow mobil date servic msg rcvd p optout txt stop repli date
2706,ham,mean come chase state watch mani movi want
2707,ham,onli took tablet reaction morn onli
2708,spam,great new offer doubl min doubl txt best orang tariff get latest camera phone free call mobileupd free stoptxt cs
2709,ham,nah perpetu dd
2710,ham,sorri de went shop
2711,spam,hope enjoy new content text stop unsubscrib helpp provid tonesyoucouk
2712,ham,wen ur lovabl bcum angri wid u dnt take seriously coz angri childish n true way show deep affect care n luv kettoda manda nice day da
2713,ham,hey still want go yogasana coz end cine go bath hav steam bath
2714,ham,nope drivin neva develop da photo lei
2715,ham,think go reg pract lessons flung advance haha wat time u go
2716,ham,cool lt gt inch long hope like big
2717,ham,housemaid murder coz man wa murder lt gt th january public holiday govtinstituit close includ post officeunderstand
2718,ham,okie thanx
2719,spam,day euro kickoff u kept inform latest news result daili unsubscrib send get euro stop
2720,ham,go n buy juz buy get lar
2721,ham,ok lor
2722,ham,work technic support voic process
2723,ham,justbeen overa week sinc broke alreadi brain go mush
2724,ham,tund thi wish great day abiola
2725,ham,nope c ü
2726,ham,medic mission nigeria
2727,ham,ani movi laptop
2728,ham,whatsup dont u want sleep
2729,spam,urgent pleas call landlin cash luxuri canari island holiday await collect cs sae award maq ppm
2730,spam,urgent pleas call landlin complimentari lux costa del sol holiday cash await collect ppm sae cs jame ehrr
2731,ham,havent lei next mon
2732,ham,mm feel sleepi today shall get dear
2733,ham,dare stupid wont tell anyth hear wont talk
2734,ham,ü noe ben go
2735,ham,mag meet thi avo point
2736,ham,meant middl left right
2737,ham,realli crash cuddl sofa
2738,ham,hi chachi tri call u unabl reach u pl give miss cal onc u c tiz msg kanagu
2739,ham,sent price mean lt gt g
2740,ham,thi much buzi
2741,ham,noth
2742,spam,nt know u u nt know send chat let find onli pmsg rcvd hgsuitelandsrowwjhl ldn year
2743,ham,work ring u thing whole hous scream brat pull hair love u
2744,ham,famili respond anyth room went home diwali one call whi come make feel like die
2745,ham,tick tick tick babe
2746,ham,r ü go today meet
2747,ham,k da mani page want
2748,ham,ya nowonion roast
2749,ham,send hi number give repli tomorrow morn whi said like ok
2750,ham,said problem let know
2751,ham,ok tell half hr b u come need prepar
2752,ham,play w comput aiyah tok u lor
2753,ham,sat right okay thank
2754,ham,derp wors dude alway want parti dude file complaint three drug abus live
2755,ham,ok chines food way get fat pay lipo
2756,ham,r outsid alreadi
2757,ham,good trip watch rememb get back must decid easter
2758,ham,yo watch movi netflix
2759,ham,time prob
2760,ham,meh thgt clash realli ah dun mind dun seen lost ani weight gee
2761,ham,dont thnk wrong call us
2762,ham,sure night menu know onli noon menu
2763,ham,arr birthday today wish get oscar
2764,ham,say thi slowly god love amp need clean heart bloodsend thi ten special peopl amp u c miracl tomorrow pl pl
2765,ham,open rebtel firefox load put plu sign user name place show two number lower number number onc pick number pin display okay
2766,ham,pick variou point
2767,spam,marri local women look discreet action real match instantli phone text match msg cost p stop txt stop bcmsfwcnxx
2768,ham,wow v v impress fun shop
2769,ham,way ur home
2770,spam,burger king wan na play footi top stadium get burger king befor st sept go larg super cocacola walk winner
2771,ham,problem talk later
2772,ham,ur si
2773,ham,still custom place
2774,spam,come take littl time child afraid dark becom teenag want stay night
2775,ham,dude u knw also telugutht gudk gud nyt
2776,ham,confirm eat esplanad
2777,ham,send id password
2778,ham,kind took garag centr part exhaust need replac part order n take fix tomo morn
2779,spam,ur chanc win cash everi wk txt action c wwwmovietriviatv custcar xpwk
2780,ham,well might come
2781,ham,long quit get onli like minut day
2782,ham,like call mittelschmertz googl dont paracetamol dont worri go
2783,ham,well thi right gon na get check today steam salespe text want come get
2784,ham,arriv see coupl day lt
2785,ham,k wat tht incid
2786,ham,yeah get unlimit
2787,ham,cthen thk shd b enuff still got conclus n content pg n references b da content pg n cover pg
2788,ham,forgot take year shower sorri atyour phone dead yet
2789,ham,ü got wat buy tell us ü need come
2790,ham,big god bring success
2791,spam,u bin award play instant cash call claim everi th player win min optout
2792,ham,r stayin extra week back next wed rugbi thi weekend hi c u soon
2793,ham,well still bit left guy want tonight
2794,ham,thi campu librari
2795,ham,affidavit say lt gt e twigg st divis g courtroom lt gt lt time gt doubl check text tomorrow
2796,ham,creep
2797,ham,tell friend plan valentin day lt url gt
2798,ham,get befor ten billion call text help god
2799,ham,puriti friendship two smile read forward messageit smile see name gud evng musthu
2800,ham,told return order
2801,ham,housemaid murder coz man wa murder lt gt th january public holiday govtinstituit close includ post office
2802,ham,depend u go lor
2803,ham,smile right go world wonder smile think crazi keep away grins
2804,spam,freemsg fav xma tone repli real
2805,ham,lil fever fine
2806,ham,think still car
2807,ham,
2808,spam,decemb onli mobil mths entitl updat latest colour camera mobil free call mobil updat co free
2809,ham,ye princess want catch big strong hand
2810,ham,oh yeah forgot u onli take shop onc
2811,ham,mm ask call radio
2812,ham,thinkin someon good drug
2813,ham,say thi slowly god love amp need clean heart bloodsend thi ten special peopl amp u c miracl tomorrow pl pl
2814,ham,enjoy shower possess pour u ur love one bcoz thi world lie golden gift love truly
2815,ham,alright sure let know leav
2816,ham,last much hour might get lucki
2817,ham,geniu brother pl send hi number skype
2818,spam,gr poli tone mob direct u rpli poli titl eg poli breathe titl crazyin sleepingwith finest ymca getzedcouk poboxowwq p
2819,ham,thk em find wtc far weiyi goin e rest dunno yet r ur goin dinner den might b abl join
2820,ham,nt forget privat properti good boy alway passion kiss
2821,spam,interflora late order interflora flower christma call place order befor midnight tomorrow
2822,ham,oh godtaken teeth pain
2823,spam,romcapspam everyon around respond well presenc sinc warm outgo bring real breath sunshin
2824,ham,u ask darren go n pick u lor oso sian tmr haf meet lect
2825,ham,need buy lunch eat maggi mee
2826,spam,congratul thank good friend u xma prize claim easi call onli p per minut btnationalr
2827,ham,ok lor
2828,ham,oh right ok make sure load work dure day got realli nasti cough today dri n shot realli help
2829,ham,wifehow knew time murder exactli
2830,spam,send logo ur lover name join heart txt love name name mobno eg love adam eve yahoo poboxwwq txtno ad p
2831,ham,howz person stori
2832,ham,thanx send home
2833,ham,normal hot mail com see
2834,spam,tkt euro cup final cash collect call b pobox ppm
2835,ham,u sick still go shop
2836,ham,ya well fine bbd pooja full pimpleseven becom quit blackand ur rite cold wear sweatter
2837,ham,nicenicehow work
2838,ham,reach home call
2839,ham,tri find chines food place around
2840,ham,easi mate guess quick drink wa bit ambiti
2841,ham,babe miiiiiiissssssssss need crave geeee sad without babe love
2842,ham,ok thanx
2843,ham,aathiwher dear
2844,ham,tunji queen thi wish great day abiola
2845,ham,today iz yellow rose day u love frndship give misscal amp send thi ur frndz amp see mani miss call u get u get miss u marri ur lover
2846,ham,class hour sorri
2847,ham,wat time u finish ur lect today
2848,spam,freemessag jamster get crazi frog sound poli text mad real text mad crazi sound gbpweek onli c appli
2849,ham,sad stori man last week wa bday wife didnt wish parent forgot n kid went work even colleagu wish enter cabin pa said happi bday boss felt special askd lunch lunch invit apart went said u mind go bedroom minut ok sed sexi mood came minut latr wid cake n wife parent kidz friend n colleagu screaming surpris wa wait sofa nake
2850,spam,chanc realiti fantasi show call p per min ntt ltd po box croydon cr wb nation rate call
2851,ham,fine good hear dear happi new year oh
2852,ham,go wipro interview today
2853,ham,tall princess
2854,ham,doubt could handl time per night ani case
2855,ham,haha hope ü hear receipt sound gd luck
2856,ham,gon na death gon na leav note say rob fault aveng
2857,ham,japanes proverb one u none u must indian version one let none leav final kerala version one stop none make strike
2858,ham,today workin free oso gee thgt u workin ur fren shop
2859,ham,life face choic toss coin becoz settl question coin air u know heart hope gudni
2860,ham,know whi god creat gap fingers one made come amp fill gap hold hand love
2861,ham,want kiss feel next
2862,ham,happi say
2863,spam,adult content video shortli
2864,ham,ok would b love u r sure think wot u want drinkin dancin eatin cinema u wot
2865,ham,say nt explicitli told nora know someon probabl gon na bother
2866,ham,say hi get ass back south tampa prefer kegger
2867,ham,smith wast dai wan na gayl
2868,ham,mum sent mani mani messag sinc got want know actual get enjoy rest day
2869,ham,aight tomorrow around lt gt
2870,ham,housemaid murder coz man wa murder lt gt th january public holiday govtinstituit close includ post officeunderstand
2871,spam,chanc realiti fantasi show call p per min ntt ltd po box croydon cr wb nation rate call
2872,ham,actual first time went bed long spoke woke wa night
2873,ham,see
2874,ham,dont understand messag
2875,ham,crucifi c told earlier
2876,ham,idk keep say sinc move keep head freedom vs respons tire much shit deal bare keep togeth onc thi get ad
2877,ham,fuck cedar key fuck come anyway tho
2878,ham,twenti past five said thi train durham alreadi coz reserv seat
2879,spam,hey boy want hot xxx pic sent direct ur phone txt porn hr free p per day stop text stopbcm sf wcnxx
2880,ham,u still paint ur wall
2881,spam,last chanc claim ur worth discount voucher today text shop savamob offer mobil cs savamob pobox muz sub
2882,ham,printer cool mean groovi wine groovi
2883,ham,hi harish rent ha transfr ur acnt
2884,ham,anyth lor come
2885,ham,cbe realli good nowaday lot shop showroom citi shape good
2886,ham,ü still attend da talk
2887,ham,prob hon u doinat mo
2888,ham,k take care
2889,ham,take nt phone callon friday assum wo nt thi year
2890,ham,batteri low babe
2891,ham,shuhui ha bought ron present swatch watch
2892,ham,yeah quit bit left swing tomorrow get
2893,ham,babe said hour almost internet
2894,ham,k sure get befor noon see
2895,ham,k k yesterday wa cbe
2896,ham,went ganesh dress shop
2897,spam,pdatenow doubl min txt orang tariff latest motorola sonyericsson nokia bluetooth free call mobileupd calloptout yhl
2898,ham,ü collect ur laptop go configur da set izzit
2899,ham,r home come within min
2900,ham,aight latest probabl closer jay tyler two trip
2901,ham,come aftr lt decim gt clean hous
2902,spam,ur cashbal current pound maxim ur cashin send cash onli pmsg cc po box tcrw
2903,ham,bill ani letter expect one orang bill may still say orang
2904,ham,tell pa pain de
2905,ham,hi darlin hope nice night wish come cant wait see love fran ps want dirti anal sex want man gang bang
2906,ham,ha know either clever simpl thing pear day perfect christma
2907,ham,helloooo wake sweet morn welcom enjoy thi day full joy gud mrng
2908,ham,alrit
2909,ham,whi must sit around wait summer day celebr magic sight world dress white oooooh let snow
2910,spam,urgent mobil number ha award prize guarante call land line claim valid hr onli
2911,ham,guy go see movi side
2912,ham,sorri meet call later
2913,ham,nt tell think plu go stop run
2914,ham,kindli send one flat befor lt decim gt today
2915,spam,sorri u unsubscrib yet mob offer packag ha min term week pl resubmit request expiri repli themob help info
2916,ham,noth lor bit bore dun u go home earli sleep today
2917,ham,time tell friend around
2918,ham,ye fine love safe
2919,ham,thank chikku gud nyt
2920,ham,xy ur car u pick
2921,ham,thanx time v spent geva bin mint ur babi want u xxxx
2922,ham,yo ani way could pick someth tonight
2923,ham,sent send
2924,ham,fine simpli sit
2925,ham,tht god gift bird human hav natur gift frm god
2926,ham,come day class
2927,ham,im done studyn librari
2928,ham,ok u enjoy ur show
2929,ham,anyth
2930,ham,wuld without babi thought alon mite break wan na go crazi everyboy need hi ladi xxxxxxxx
2931,ham,wat dear sleep ah
2932,ham,hi test lt gt rd
2933,ham,onli student solv thi cat question xam lt gt lt gt lt gt tell answer u r brilliant thingi got answr
2934,ham,yo know anyon lt gt otherwis abl buy liquor guy flake right nt get hold somebodi loko night
2935,ham,yup n fren lor meet fren
2936,ham,yeah got one line us
2937,ham,stop wonder wow ever go stop tming becaus tm whenev want becaus mine laughs
2938,ham,lol yep yesterday alreadi got fireplac anoth icon sit
2939,ham,hey book pilat yoga lesson alreadi haha
2940,ham,ok happen behav like thi
2941,spam,new messag pleas call
2942,ham,supervisor find one lor thk hi student havent ask yet tell u aft ask
2943,ham,hello news job make wait fifth week yeah im woozl weasel exet still home
2944,ham,messageno responcewhat happend
2945,spam,current messag await collect collect messag call
2946,ham,hey babe sorri nt get sooner gari come fix caus think know doe nt go far ptbo say cost lt gt buck nt know might cheaper find someon nt ani second hand machin right let know want babe
2947,ham,make fuck sake x
2948,ham,leav u alway ignor
2949,ham,nope b go sch fri quit earli lor co si got paper da morn
2950,ham,bruce b amp fletcher
2951,ham,said would woke
2952,ham,hey free call
2953,ham,tell thi pl
2954,spam,urgent mobil wa award bonu caller prize final attempt contact u call
2955,ham,think might give miss teach til twelv lectur two damn thi work thing
2956,ham,id check onli like bowl worth left
2957,ham,ye mani sweet
2958,ham,would still cozi exhaust last nightnobodi went school work everyth close
2959,spam,u secret admir reveal think u r special call opt repli reveal stop per msg recd cust care
2960,ham,buzzzz grins buzz ass buzz chest buzz cock keep phone vibrat feel shake
2961,ham,sir send group mail check
2962,ham,da intro cover energi trend n pro n con brief descript nuclear fusion n oso brief histori iter n jet got abt n half pages
2963,ham,none nowher ikno doesdiscount shitinnit
2964,ham,dont know jabo abi
2965,spam,ever notic drive anyon go slower idiot everyon drive faster maniac
2966,ham,yet hadya sapna aunti maneg yday hogidhechinnu full weak swalpa black agidhane
2967,ham,good babi
2968,ham,neft transact refer number lt gt rs lt decim gt ha credit beneficiari account lt gt lt time gt lt gt
2969,ham,mostli sport typelyk footbl crckt
2970,ham,head dey swell oh thank make day
2971,ham,u make fb list
2972,ham,height confid aeronaut professor wer calld amp wer askd sit aeroplan aftr sat wer told dat plane ws made student dey hurri plane bt onli didnt move said made student thi wont even start datz confidence
2973,ham,sari need tim bollox hurt lot tol
2974,ham,happi new year princess
2975,ham,text carlo let know hang
2976,ham,nt worri easi onc ingredi
2977,ham,love u littl poci bell sorri love u
2978,ham,ok omw castor
2979,ham,yar lor keep rain non stop u wan go elsewher
2980,spam,xma offer latest motorola sonyericsson nokia free bluetooth dvd doubl min txt orang call mobileupd calloptoutqf
2981,ham,u mean u almost done done wif sleep tot u go take nap yup send liao pick ard smth lor
2982,ham,wonder world th th ur style th ur smile th ur person rd ur natur nd ur sm st ur love friendship good morn dear
2983,ham,tonight yeah
2984,ham,eat fo lunch senor
2985,ham,said right giggl saw u would possibl first persondi nvq think much could
2986,ham,break time one come n get stuff fr ü
2987,spam,repli win weekli profession sport doe tiger wood play send stop end servic
2988,ham,see ca nt see mayb reboot ym seen buzz
2989,ham,still grinder
2990,spam,polyphon tone ur mob everi week txt pt st tone free get txtin tell ur friend ptone repli hl info
2991,ham,love nt decis feel could decid love life would much simpler less magic
2992,spam,hot live fantasi call p per min ntt ltd po box croydon cr wb nation rate call
2993,ham,ki didt see k
2994,ham,list buyer
2995,ham,idea guess work hour suppos leav sinc usual nobodi ha ani interest figur shit befor last second
2996,ham,mm entir sure understood text hey ho weekend
2997,ham,releas vday shirt u put make bottom half nake instead white underwear
2998,ham,knowh watch film computer
2999,ham,b thursday
3000,ham,oh phone phone disconnect
3001,ham,id onluy matter get offcampu
3002,spam,thi messag free welcom new improv sex dog club unsubscrib thi servic repli stop msg p onli
3003,ham,excel see riley plan
3004,ham,see half hour
3005,spam,tkt euro cup final cash collect call b pobox ppm
3006,ham,ew one
3007,ham,also hi wesley
3008,ham,ah see lingo let know wot earth ha finish make
3009,spam,loan ani purpos homeown tenant welcom previous refus still help call free text back help
3010,spam,updatenow mth half price orang line rental min call mobileupd calloptoutjq
3011,ham,imagin life without see fast u search nt worry l alway disturb u goodnoon
3012,ham,hm good morn headach anyon
3013,ham,yeah prob last night obvious catch speak soon
3014,spam,free unlimit hardcor porn direct mobil txt porn get free access hr chrgd p per day txt stop exit thi msg free
3015,ham,might go sch yar e salon v bore
3016,ham,lt gt min stop somewher first
3017,ham,lt gt fast approach wish u veri happi new year happi sankranti happi republ day happi valentin day happi shivratri happi ugadi happi fool day happi may day happi independ day happi friendship mother father teacher children day amp happi birthday u happi ganesh festiv happi dasara happi diwali happi christma lt gt good morn afternoon even night rememberi first wish u raj
3018,ham,one joy lifei wake daywith thought somewheresomeon care enough tosend warm morn greeting
3019,ham,nt get second half messag
3020,ham,wat time u wan meet later
3021,ham,thank much selfless love plenti
3022,ham,film ill call later
3023,ham,dare chang ring
3024,ham,veri veri veri veri bad girl ladi
3025,ham,love ya tri budget money better babe gari would freak knew
3026,ham,part nt initi nt understand
3027,ham,finish lunch alreadi u wake alreadi
3028,ham,still game
3029,ham,got tallent wast
3030,ham,record one night
3031,ham,also sir sent email log usc payment portal ill send anoth messag explain thing back home great weekend
3032,ham,gon na let know co come bak holiday day come dontgettext number
3033,ham,jokin onli lar depend phone father get lor
3034,ham,aight lem know
3035,ham,get readi lt gt inch pleasur
3036,ham,rajipl favour pl convey birthday wish nimya pl today birthday
3037,ham,ok feel like john lennon
3038,ham,co darren say ü consid mah ask ü
3039,ham,bother trust answer pl
3040,ham,wish famili merri x happi new year advance
3041,ham,one day crab wa run sea shoreth wave came n clear footprint crab crab ask frnd r u clear beauti footprint wave repli fox wa follow ur footprint catch clear frndsship never let u dwn gud nyt
3042,ham,aight time want come
3043,ham,slaaaaav must summon time nt wish come anymor
3044,ham,bill bad
3045,ham,let know chang next hr even appendix age rang howev imposs chill let know hr
3046,ham,hello yeah got bath need hair come done yeah
3047,ham,weather
3048,ham,ok much though h friday cant wait dunno wot hell im gon na anoth week becom slob oh wait alreadi done
3049,ham,die e toot fring
3050,ham,lol nt know awesom phone could click delet right want
3051,ham,ok
3052,ham,awesom question cute answer someon ask boy ur life smile amp answer fine gudnit
3053,ham,pleas leav thi topicsorri tell
3054,ham,pl send correct name da
3055,ham,happen yo date
3056,spam,eastend tv quiz flower doe dot compar violet e tulip f lili txt e f chanc win cash wkentp
3057,ham,webpag avail
3058,ham,woke yeesh late nt fall asleep til lt gt
3059,spam,unsubscrib servic get ton sexi babe hunk straight phone go http gotbabescouk subscript
3060,ham,dear know lt gt th lt gt th birthday love gopalettan plan give small gift day like particip welcom pleas contact admin team detail
3061,ham,kk tomorrow onward start ah
3062,ham,u talk bout earli morn almost noon
3063,ham,fine rememb
3064,spam,hi babe jordan r u im home abroad lone text back u wan na chat xxsp visionsmscom text stop stopcost p
3065,ham,ok mani buy
3066,ham,sound good keep post
3067,spam,get brand new mobil phone agent mob plu load goodi info text mat
3068,ham,ok april cant wait
3069,ham,boy best get yo ass quick
3070,ham,ay wana meet sat ü wkg sat
3071,ham,wait till bu pick
3072,ham,apart one told yesterday
3073,ham,ok lor buy wat
3074,ham,somebodi go andro steal ice
3075,ham,know didt msg recent
3076,ham,take us shop mark distract isaiahd
3077,ham,mum hope great day hope thi text meet well full life great day abiola
3078,ham,sens foot peni
3079,ham,okay thought expert
3080,ham,deep sigh miss realli surpris nt gone net cafe yet get nt miss
3081,ham,thinl role like sachinjust stand hit
3082,ham,great trip india bring light everyon project everyon lucki see smile bye abiola
3083,ham,veri importantli discuss u onli
3084,ham,kk train process
3085,ham,ok lor ned go toa payoh return smth u wan send wat
3086,ham,da car park
3087,ham,wish wa hold tightli make see import much mean much need life
3088,ham,ask anthoni dad bf
3089,ham,wnevr wana fal luv vth book bed fal luv vth yen madodu nav pretsorginta nammanna pretsovru import alwa gud eveb
3090,ham,todaysundaysunday holidayso work
3091,ham,go take bath ill place key window
3092,spam,lord ring return king store repli lotr june chanc win lotr soundtrack cd stdtxtrate repli stop end txt
3093,ham,dear take care reach homelov u lot
3094,ham,staffsciencenusedusgphyhcmkteachingpc
3095,ham,emigr someth ok mayb wa bit hope
3096,ham,olol print forum post guy exact prob wa fix gpu replac hope dont ignor
3097,ham,walk mom right stagwood pass right winterston left victor hill address lt gt
3098,ham,yo jp hungri like mofo
3099,ham,thi creepi crazi
3100,ham,ok din get ur msg
3101,ham,tessypl favor pl convey birthday wish nimyapl dnt forget today birthday shija
3102,ham,pathaya enketa maraikara pa
3103,ham,even friend priest call
3104,ham,u lousi run alreadi come back half dead hee
3105,ham,said bad dat e gal know u wat u
3106,ham,remind hr
3107,ham,hope would send thi messag rent due dont enough reserv complet gone loan need wa hope could balanc lt gt way could get till mid march hope pay back
3108,ham,hi happi new year dont mean intrud pl let know much tuition paid last semest much thi semest thank
3109,ham,hello hun ru way im good date guy met walkabout far meet soon everyon els
3110,ham,lol wa gon na last month cash left lt gt case wa collect dure week caus announc blog
3111,spam,good luck draw take place th feb good luck remov send stop custom servic
3112,ham,short cute good person dont tri prove gud mrng
3113,ham,nt decid yet eh
3114,ham,wat time liao still got
3115,ham,ye watch footi worri go blow phil nevil
3116,ham,wait ü insid da car park
3117,ham,uncl abbey happi new year abiola
3118,ham,free call pa
3119,ham,r u say order slipper co pay return
3120,ham,stop know well
3121,ham,good even thi roger
3122,ham,small problem auction punj ask tiwari
3123,spam,free entri weekli comp chanc win ipod txt pod get entri std txt rate c appli detail
3124,ham,tell tell ani one treat hi hi hi
3125,ham,uncl atlanta wish guy great semest
3126,spam,st wk free gr tone str u wk txt nokia classic nokia tone hit poli nokiap polyp
3127,ham,u come pick
3128,ham,cool like photo veri sexi
3129,ham,would u fuckin believ didnt know thur pre book cancel need b sack
3130,ham,haha better late ever ani way could swing
3131,ham,ok finish
3132,spam,lookatm thank purchas video clip lookatm charg p think better whi send video mmsto
3133,ham,bar b q store life thi twat orang dungere came ask want deck got first punch
3134,ham,messag food
3135,ham,ok go sleep hope meet
3136,ham,wat make peopl dearer de happi dat u feel u meet de pain u feel u miss dem
3137,ham,let know detail fri u find co tom fri mention chines thank
3138,ham,right think
3139,ham,wat r u
3140,ham,ur lectur
3141,spam,sexi sexi cum text im wet warm readi porn u fun thi msg free recd msg p inc vat cancel text stop
3142,ham,custom place call
3143,ham,plan yet go join compani jan onlydon know happen
3144,ham,boy love u grl hogolo boy gold chain kodstini grl agalla boy necklac madstini grl agalla boy hogli mutai eerulli kodthini grl love u kano
3145,ham,haha heard text around
3146,ham,ill get tomorrow send
3147,ham,shit babe thasa bit mess upyeh shudvetold u urgran know neway illspeak umoro wen im asleep
3148,ham,oh late well good night give u call tomorrow iam go go sleep night night
3149,ham,cheer u tex mecaus u werebor yeah okden hunni r uin wk sat sound likeyour havin grfun j keep updat countinlot lovem xxxxx
3150,ham,sorri meet call later
3151,ham,yo howz u girl never rang india l
