,Type,SMS
4076,ham,god pick flower dippeditinadew lovingli touch itwhichturnedinto u gift tomeandsaid thi friend u
4077,spam,kick new season wk free goal news ur mobil txt ur club name eg villa
4078,ham,hey sathya till dint meet even singl time saw situat sathya
4079,ham,gam gone outstand inning
4080,ham,play smash bro lt gt religi
4081,ham,sir good morn hope good weekend call let know wa abl rais lt gt dad howev said would make rest avail mid feb thi amount still quit short wa hope would help good day abiola
4082,ham,hurri home soup done
4083,ham,check room befor activ
4084,ham,good afternoon love wa good see word ym get tm veri smart move slave smiles drink coffe await
4085,ham,quit ok bit ex u better go eat smth els feel guilti
4086,spam,orang bring rington time chart hero free hit week go rington pic wap stop receiv tip repli stop
4087,ham,lem know
4088,spam,privat account statement show unredeem point call identifi code expir
4089,ham,need stop go bed make fuck deal
4090,ham,love brother time talk english grins say hey muhommad penni say hello across sea
4091,spam,tri call repli sm video mobil min unlimit text free camcord repli call
4092,ham,hey doc pl want get nice shirt hubbi nice fite one budget lt gt k help pl load card abi hw keep post luv mj
4093,ham,remain unconvinc thi nt elabor test willpow
4094,ham,life noth wen v get everyth life everyth wen v miss someth real valu peopl wil realiz onli absenc gud mrng
4095,ham,miss
4096,ham,ai nt answerin phone actual pretti reason hour sleepi
4097,ham,hey rite u put evey mnth
4098,ham,go bed prin
4099,ham,think thank see tomo
4100,ham,u dun drive go sch
4101,ham,home lei
4102,spam,gsoh good spam ladi u could b male gigolo join uk fastest grow men club repli oncal mjzgroup stop repli stop msg rcvd
4103,ham,ok come ur home half hour
4104,spam,u secret admir look make contact ufind rreveal think ur specialcal
4105,ham,u hav ani frnd name ashwini ur colleg
4106,ham,ju finish lunch way home lor tot u dun wan stay sch today
4107,ham,k marrow come class
4108,spam,hot live fantasi call p per min ntt ltd po box croydon cr wb nation rate call
4109,ham,pl send address sir
4110,ham,want lick pussi
4111,ham,yo gon na still stock tomorrowtoday tri get dubsack
4112,spam,urgent mobil number ha award ukp prize guarante call landlin claim valid hr onli ppm
4113,ham,see prolli yeah
4114,ham,thought could go dinner treat seem ok
4115,ham,stand away doe nt heart ach without nt wonder nt crave
4116,ham,sorri never hear unless book one wa kinda joke thet realli look skinni white girl wa one line onli much camera someth like cast look
4117,ham,
4118,ham,sure thing big man hockey elect go longer hour though
4119,ham,watch lor saw swatch one thk quit ok ard need nd opinion leh
4120,ham,hiya u like hlday pic look horribl took mo camp amrca thing speak soon serena
4121,ham,babe goe day miss alreadi love love kiss hope everyth goe well
4122,ham,yunni goin late
4123,ham,doc prescrib morphin caus pain med nt enough wait mom bring med kick fast gon na tri later
4124,ham,cool want go kappa meet outsid mu
4125,ham,hey sexi bun told ador loverboy hope rememb thank sister law meatbal grins love babe
4126,ham,may b approv panalam posts
4127,spam,spjanuari male sale hot gay chat cheaper call nation rate pmin cheap pmin peak stop text call pmin
4128,ham,sorri call later
4129,ham,dont thnk wrong call us
4130,ham,workin onc get job
4131,ham,done mean
4132,ham,ur luck love someon ur fortun love one love u miracl love person ca nt love anyon except u gud nyt
4133,ham,hi babi ive got back work wa want see u allday hope didnt piss u phone today u give call xxx
4134,spam,freemsg today day readi horni live town love sex fun game netcollex ltd p per msg repli stop end
4135,ham,yahoo boy bring perf legal
4136,ham,need say anyth know outsid
4137,ham,ever one foot befor
4138,ham,got lt gt
4139,ham,good need ani receipts wel done ye pleas tell number could ring
4140,ham,ever green quot ever told jerri cartoon person irrit u alway one love u vri much fail express gud nyt
4141,ham,leav wif lar ü wan carri meh heavi da num familiar ü
4142,ham,beauti truth express face could seen everyon depress heart could understood onli love ones gud ni
4143,ham,infact happi new year see
4144,spam,simpson movi releas juli name band die start film agreen day bblue day cred day send b c
4145,ham,shame mayb cld meet hr tomo
4146,ham,lol would despit cramp like girl
4147,ham,wait cornwal hope tonight bad well rock night shite anyway go kip good night speak soon
4148,ham,pl help tell sura expect batteri hont pl send messag download movi thank
4149,spam,pleas call amanda regard renew upgrad current tmobil handset free charg offer end today tel subject c
4150,ham,nt found way get anoth app phone eh go net cafe take job geeee need babe crave see
4151,ham,onli work mon thur sat cant leh book liao day u free
4152,ham,ü comin fetch us oredi
4153,ham,nanni address
4154,spam,urgent costa del sol holiday await collect call toclaim sae tc pobox stockport skxh cost pm maxmin
4155,ham,haf u eaten wat time u wan come
4156,spam,want new video phone anytim ani network min half price line rental free text month repli call free deliveri
4157,ham,yo call get chanc friend mine want ask big order
4158,ham,thi singl singl answer fight plu said broke didnt repli
4159,ham,certainli put thing perspect someth like thi happen
4160,ham,got tv watch meh u work today
4161,ham,felt ani convey reason ese
4162,spam,mobil month u r entitl updat latest colour mobil camera free call mobil updat co free
4163,ham,go got ani excit karaok type activ plan debat whether play footbal thi eve feel lazi though
4164,ham,told come wednesday
4165,ham,ok call mom instead fun
4166,spam,dear voucher holder claim thi week offer pc pleas go http wwwwtlpcouktext ts cs appli
4167,ham,well desper call armand
4168,ham,work right
4169,spam,congrat nokia video camera phone call call cost ppm ave call min vari mobil close post bcm ldn wcnxx
4170,ham,nt heard anyth answer text guess flake said jb fantast
4171,ham,mmmmmm love much ahmad ca nt wait thi year begin everi second take closer side happi new year love
4172,ham,pl full name joke school co fee univers florida seem actual lt gt k pl holla back
4173,ham,sorri call later
4174,ham,ok said got wisdom teeth hidden insid n mayb need remov
4175,ham,pl pl drink plenti plenti water
4176,ham,queen go royal wed
4177,ham,lag sad part keep touch thank skype
4178,ham,ok lor go tog lor
4179,ham,two team wait player
4180,ham,ü send copi da report
4181,ham,swhrt u dey hope ur ok tot u daylov n misstak care
4182,ham,ok da alreadi plan wil pick
4183,spam,urgent pleas call abta complimentari spanish holiday cash await collect sae cs box po ez ppm
4184,ham,sorri call later meet
4185,ham,realli need shit befor tomorrow know wo nt awak befor like
4186,ham,good regist vote
4187,ham,hmm ok stay like hour co eye realli sore
4188,ham,dear got bu directli calicut
4189,ham,mm umma ask vava also come tell play later togeth
4190,ham,well gener price lt gt oz let know ifwhenhow much want
4191,ham,sorri call later
4192,ham,moment day ha valuemorn bring hope afternoon bring faith even bring luv night bring rest wish u find todaygood morn
4193,ham,lt gt w jetton ave forgot
4194,ham,ok come home
4195,ham,use foreign stamp thi countri
4196,spam,doubl min txt month free bluetooth orang avail soni nokia motorola phone call mobileupd calloptoutndx
4197,ham,sorri lot friendofafriend stuff talk actual guy want buy
4198,spam,free st week nokia tone ur mob everi week txt nokia get txting tell ur mate wwwgetzedcouk pobox wwq normpton
4199,spam,want funk ur fone weekli new tone repli tonesu thi text wwwringtonescouk origin n best tone gbp network oper rate appli
4200,spam,cmon babe make horni turn txt fantasi babe im hot sticki need repli cost cancel send stop
4201,ham,come tomorrow di
4202,ham,wyli updat weed dealer carlo went freedom class lunsford
4203,ham,happi babi alright take job hope fine send kiss make smile across sea kiss kiss
4204,ham,c movi juz last minut decis mah juz watch lar tot ü interest
4205,ham,enjoy thi semest take care brother
4206,spam,import inform orang user xxxxxx today ur lucki day find whi log onto http wwwurawinnercom fantast prizeawait
4207,ham,get door
4208,ham,let use next week princess
4209,ham,go home first lar ü wait lor put stuff first
4210,ham,want kfc tuesday onli buy meal onli gravi onli mark
4211,ham,da stupid daalway send like thi believ ani messagepandi mental
4212,ham,oi gon na ring
4213,spam,miss call alert number call left messag
4214,ham,attend noth
4215,ham,ard like dat lor juz meet mrt station ü dun haf come
4216,ham,dear wa sleep p
4217,ham,er mw im fill tuth aight
4218,ham,offic around pm go hospit
4219,ham,actual wait week start put ad
4220,ham,anyth lor go go lor
4221,ham,u free sat rite u wan watch infern affair wif n darren n mayb xy
4222,ham,plz note anyon call mobil co amp ask u type lt gt lt gt disconnect call coz iz attempt terrorist make use sim card itz confirmd nokia n motorola n ha verifi cnn ibn
4223,ham,yo around friend mine lookin pick later tonight
4224,ham,stupid auto correct phone
4225,ham,doubl evict thi week spiral michael good riddanc
4226,ham,world suffer lot becaus violenc bad peopl becaus silenc good peopl gud night
4227,ham,ok cool either raglan rd edward rd behind cricket ground gim ring ur closebi see tuesday
4228,ham,buy one egg dapleas
4229,ham,start skye
4230,ham,bookedth hut also time way
4231,ham,sever sir
4232,ham,u realli pig leh sleep much dad wake smth eat lunch today
4233,ham,home pleas call
4234,ham,love hope anyth drastic nt dare sell pc phone
4235,ham,onli reach home veri tire come tomorro
4236,spam,freemsg record indic may entitl pound accid claim free repli ye thi msg opt text stop
4237,spam,u win music gift voucher everi week start txt word draw tsc wwwidewcom skillgam winaweek age ppermesssubscript
4238,ham,life style garment account pleas
4239,ham,lol wtf random btw lunch break
4240,ham,sez u de arab boy hope u r good give love evry love ya eshxxxxxxxxxxx
4241,ham,lay man let know miss thought great day send bimbo ugo number ill appreci safe
4242,ham,detroit home snow enjoy
4243,spam,show ur colour euro offer get england flag lion tone ur phone click follow servic messag info
4244,ham,oki
4245,ham,aight chillin friend room text way
4246,ham,toshiba porteg gd
4247,ham,well welp sort semiobscur internet thing
4248,spam,text pass collect polyphon rington normal gpr charg appli onli enjoy tone
4249,spam,accordingli repeat text word ok mobil phone send
4250,ham,loosu go hospit de dont let careless
4251,ham,much eighth
4252,ham,omg joanna freak look thru friend find photo ask stuff myspac nt even log like year
4253,ham,send ur birthdat month year tel u ur life partner name method calcul repli must
4254,ham,juz havent woke bit blur blur dad went liao cant cum oso
4255,ham,cloth jewelri trip
4256,spam,block breaker come delux format new featur great graphic tmobil buy repli get bbdelux take challeng
4257,ham,aah cuddl would lush need lot tea soup befor ani kind fumbl
4258,spam,import inform orang user today lucki day find whi log onto http wwwurawinnercom fantast surpris await
4259,ham,late
4260,ham,sad stori man last week wa bday wife didnt wish parent forgot n kid went work even colleagu wish
4261,ham,plan famili set stone
4262,ham,pl dont forget studi
4263,ham,never believ thi actual got taunton wow
4264,ham,den onli weekday got special price haiz cant eat liao cut nail oso muz wait finish drivin wat lunch still muz eat wat
4265,ham,broke list reason whi nobodi town ca nt tell sarcast faggi
4266,ham,lt decim gt common car better buy china asia find less expens ill holla
4267,ham,greatest test courag earth bear defeat without lose heart gn tc
4268,ham,sorri im stil fuck last nite went tobe got work
4269,ham,hey plan thi sat
4270,ham,beauti sleep help ur pimpl
4271,ham,great hope use connect mode men also co never know whi old friend lead today
4272,spam,natalja f invit friend repli yes see wwwsmsacunat stop send stop frnd
4273,ham,get
4274,ham,kind miss train co asthma attack nxt one half hr drive sure park
4275,ham,ball move lotwil spin last veri difficult bat
4276,ham,haiyoh mayb hamster wa jealou million
4277,ham,pleas send aunti number
4278,ham,glad follow dream
4279,ham,reach home final
4280,spam,urgent import inform user today lucki day find whi log onto http wwwurawinnercom fantast surpris await
4281,spam,winner valu network custom select receivea prize reward claim call claim code kl valid hour onli
4282,ham,wn u r hurt prsn close u fight wit dem coz somtim di fight save relat bt quiet leav nothin relation gud eveb
4283,ham,u call
4284,ham,scienc tell chocol melt sunlight pleas nt walk sunlight bcoz nt want loss sweet friend
4285,ham,ye come nyc audiit tri reloc
4286,ham,pock befor
4287,ham,congrat great want tell tell score co might make relax motiv thank share
4288,ham,wud never mind u dont miss u dont need u wil realli hurt wen u need amp u dont tell take care
4289,ham,hey mr name bill brison book one languag word
4290,ham,okay good problem thanx
4291,ham,inform ikea spell cap yell thought left sit bed among mess came said go got home class pleas nt tri bullshit make want listen less
4292,ham,call u done
4293,ham,gwr
4294,ham,best watch say caus get drunk motherfuck
4295,spam,kit strip bill p netcollex ltd po box ig oja
4296,spam,hmv bonu special pound genuin hmv voucher answer easi question play send hmv info wwwpercentrealcom
4297,spam,pleas call immedi urgent messag wait
4298,spam,thesmszonecom let send free anonym mask messagesim send thi messag theredo see potenti abus
4299,spam,well done costa del sol holiday await collect call toclaim sae tc pobox stockport skxh cost pm maxmin
4300,ham,hurt teas make cri end life die plz keep one rose grave say stupid miss u nice day bslvyl
4301,ham,erm woodland avenu somewher get parish magazin hi telephon number
4302,ham,ta job avail let know pleas co realli need start work
4303,ham,aiyar hard type u later free tell call n scold n tell u
4304,ham,yup free
4305,ham,good good billi mate gone jog enjoy concert
4306,ham,yo come carlo soon
4307,ham,awww dat sweet think someth nice time tonight ill probabl txt u later co im lone xxx
4308,ham,guess useless call u someth import
4309,ham,ha ha pop loo hello hello
4310,ham,dint tell anyth angri whi told abi
4311,spam,someon u know ha ask date servic contact cant guess call reveal po box wu
4312,ham,happen r waxsto wat want come ill get medic insur abl deliv basic care current shop right medic insur give til friday morn ill see major person guid right insur
4313,ham,keep ten rs shelf buy two egg
4314,ham,wa nt well babe swollen gland throat end
4315,ham,ur chang da report big co alreadi made chang da previou report
4316,ham,captain room
4317,ham,ca nt speak bcaz mobil problem listen nt listen voic call later
4318,ham,hiya stu wot u im much trubl home moment evon hate even u wot hell av done wont u tell text bck pleas luv dan
4319,ham,take mokka player onli
4320,ham,still play gautham
4321,ham,hey mr go sea view coupl gay mean game give bell ya finish
4322,ham,k jason say gon na around around lt gt
4323,ham,sorri abl get see morn
4324,ham,aight well keep inform
4325,ham,number sir
4326,ham,onli search good dual sim mobil pa
4327,ham,seem unnecessarili hostil
4328,ham,dude got haircut breezi
4329,spam,congrat mobil g videophon r call videochat wid ur mate play java game dload polyh music nolin rentl bx ip pm
4330,ham,appledayno doctor tulsi leafdayno cancer lemondayno fat cup milkdayno bone problm litr watrdayno diseas snd th u care
4331,ham,thought king hill thing
4332,ham,nope come onlin
4333,ham,also tell said happi birthday
4334,ham,bishan lei tot ü say lavend
4335,ham,boo time u get u suppos take shop today
4336,ham,u sound like manki scous boy steve like travel da bu homewot ha u inmind recreat di eve
4337,ham,fyi take quick shower epsilon like lt gt min
4338,ham,tuesday night r u real
4339,ham,ye appt
4340,ham,got outta class gon na go gym
4341,ham,want sent lt gt mesag today sorri hurt
4342,ham,ü write wat
4343,ham,ha would nt say nt read anyth way u seem nt like judgement save friday pub
4344,ham,valentin game send di msg ur friend answer r someon realli love u ques colour suit best
4345,ham,hi ask waheeda fathima leav
4346,ham,enjoy urself tmr
4347,ham,still around could use halfth
4348,spam,u secret admir look make contact ufind rreveal think ur specialcal
4349,ham,give us back id proof lt gt rs wont allow work come home within day
4350,ham,ü bot note oredi co juz rem got
4351,ham,ye rent veri expens way save
4352,ham,night ha end anoth day morn ha come special way may smile like sunni ray leav worri blue blue bay gud mrng
4353,ham,pain dear r u smile
4354,ham,fun fact although would think armand would eventu build toler shit consid much smoke get fuck like hit
4355,spam,import inform orang user xxxxxxx today lucki day find whi log onto http wwwurawinnercom fantast surpris await
4356,ham,sorri ca nt help thi
4357,ham,great send account number
4358,ham,hellogorg u fone wa charg lst nitw wen u texd hopeu ad nice wkend im sure u lookin ward cin u mrw luv jaz
4359,spam,date servic ha ask contact u someon shi call reveal pobox uz p
4360,ham,ü onli send content page
4361,ham,night sweet sleep well see exorc emili rose may never sleep hug snog
4362,ham,nt think u got think use got good ni
4363,ham,ca nt right thi second got ta hit peopl first
4364,ham,evri emot ds nt hav wordsevri wish ds nt hav prayrs u smile world wit uothrwis even drop tear ds nt lik stay wit uso b happy good morn keep smile
4365,ham,rememb
4366,ham,ujhhhhhhh comput ship address sandiago parantella lane wtf poop
4367,ham,mm ye dear look hug p
4368,ham,like di sweater fr mango size alreadi irrit
4369,ham,nt number gon na massiv pain ass rather get involv possibl
4370,ham,anytim lor
4371,spam,want new video handset ani time ani network min unlimit text camcord repli call del sat
4372,ham,puriti friendship two smile read forward messageit smile see name gud evng
4373,spam,ur balanc next question complet landmark big bob b barri c ben text b c good luck
4374,ham,fineabsolutli fine
4375,ham,k sure nt consent form v
4376,spam,ur tonex subscript ha renew charg choos poli thi month wwwclubzedcouk bill msg
4377,spam,nt prize go anoth custom c wwwtcbiz pmin polo ltd suit london wj hl pleas call back busi
4378,ham,much torch ja
4379,ham,noth u dinner w us
4380,ham,check
4381,ham,done internet connect v slow send tri later first thing tomo
4382,ham,mathew tait edward anderson
4383,ham,yeah sure thing mate haunt got stuff sort im go sound anyway promot hex bi way thi dont know number joke
4384,ham,need lar go engin co si art today
4385,ham,thank honey still nt heard anyth leav bit longer crowd tri later great advic thank hope cardiff still
4386,spam,want new nokia colour phone deliv tomorrow free minut ani mobil free text free camcord repli call
4387,ham,im snowboard trip wa wonder plan get everyon togeth befor goa meet greet kind affair cheer
4388,ham,si watch live
4389,ham,see christmassi
4390,ham,k readi lt gt
4391,ham,know whi god creat gap fingers one made come amp fill gap hold hand love
4392,ham,greatest test courag earth bear defeat without lose heart gn tc
4393,ham,new year plan
4394,spam,recpt order rington order process
4395,ham,baaaaaaaab wake miss crave need
4396,ham,onli got thi messag ignor ye wa shop
4397,ham,dear whi mood cant drive brother drive
4398,ham,dad get back
4399,ham,tell shola pleas go colleg medicin visit academ depart tell academ secretari current situat ask transfer ask someon check sagamu thing lautech vital complet medic educ nigeria less expens much less expens unless get citizen rate new zealand
4400,ham,ye finish watch day live love
4401,ham,juz go googl n search qet
4402,ham,mani time lose best one bcoz
4403,ham,good friend care close friend understand true friend stay forev beyond word beyond time gud ni
4404,ham,get back home
4405,ham,sorri call later lt gt min
4406,ham,dun need use dial juz open da browser n surf
4407,spam,one regist subscrib u enter draw gb gift voucher repli enter unsubscrib text stop
4408,ham,awesom plan get ani time like lt gt text detail wee bit
4409,ham,take care sleep wellyou need learn chang lifey onli need get convinc thati wait convers usget convinc timeyour famili mani sensesrespect overemphasiseor u role life
4410,spam,chanc win free bluetooth headset simpli repli back adp
4411,ham,also didnt get na hi hi hi hi hi
4412,ham,ya cant display intern sub got ta extract
4413,ham,said anyth wrong sorri de
4414,ham,sad stori man last week wa bday wife didnt wish parent forgot n kid went work even colleagu wish
4415,ham,stupid say challeng godyou dont think write instead respond im
4416,ham,yeah abl text readi meet
4417,ham,v skint fanci bevieswaz gona go meet othr spoon jst bin watchng planet earth sofa v comfey dont make hav gd night
4418,ham,say quit leasttim day wud nt take much notic nah nt mind gon na see want come taunton tonight u tell
4419,ham,get free call
4420,ham,littl darl far thi week need coffe run tomo ca nt believ time week alreadi
4421,ham,ok msg u b leav hous
4422,ham,still west coast haiz ü take forev come back
4423,ham,mmm fuck merri christma
4424,ham,alright thank advic enjoy night ima tri get sleep
4425,ham,updat face book statu frequent
4426,ham,saw messageit k da
4427,ham,wa someth u ate
4428,ham,bank say money
4429,ham,aiyar dun disturb u liao thk u lot aft ur cupboard come
4430,ham,hey r watch movi tonight prob b home earli
4431,ham,yar lor u noe u use dat rout
4432,ham,mro come gym machan goodnight
4433,ham,dont think need yellow card uk travel ask someon ha gone befor lt gt buck
4434,ham,u look da lib got stuff havent finish yet
4435,ham,sound great im go sleep good night
4436,spam,nt b floppi b snappi happi onli gay chat servic photo upload call pmin stop text call
4437,ham,housemaid murder coz man wa murder lt gt th january public holiday govtinstituit close includ post officeunderstand
4438,ham,come u got noth
4439,ham,noth ever easi nt look reason take risk life love
4440,ham,want grasp pretti booti
4441,ham,got tea sure flavour
4442,ham,go orchard lareadi reach soon u reach
4443,ham,dear deni word pleas
4444,ham,know old dom told yesterday hi name roger got touch last night want meet today pm
4445,ham,come back tampa ffffuuuuuuu
4446,ham,celebr b day els
4447,ham,merri christma u anni
4448,ham,pleas tell special stock talk
4449,ham,sent like
4450,spam,urgent ur award complimentari trip eurodisinc trav aco entry claim txt di morefrmmob shracomorsglsuplt ls aj
4451,ham,awesom minut
4452,ham,problem walk around julianaland oblivi go around say thing constantli go one ear go whatev want nt know whi upset nt listen tell go upset want surpris mad
4453,ham,told everyth stop dont let get dehydr
4454,ham,guess lt gt min
4455,ham,home ard wat time u reach
4456,ham,storm msg wen u lift phne u say hello u knw wt real mean hello name girl yes u knw dat girl margaret hello girlfrnd f grahmbel invnt telphon moral one get name person bt hi girlfrnd g n g h
4457,ham,want mapquest someth look usf dogwood drive tini street park lot
4458,ham,aight plan come later tonight
4459,ham,die accident delet e msg suppos put e sim archiv haiz sad
4460,spam,welcom ukmobiled thi msg free give free call futur mg bill p daili cancel send go stop
4461,ham,thi wish great day moji told offer alway wa speechless offer easili go great length behalf stun exam next friday keep touch sorri
4462,ham,thank repli today ur visa come r u still buy gucci bag sister thing easi uncl john also ha hi bill realli need think make money later sha
4463,ham,sorri flake last night shit serious goin roommat tonight
4464,ham,said look pretti wif long hair wat thk cut quit short leh
4465,ham,ranjith cal drpd deeraj deepak min hold
4466,ham,cheer callin babesozi culdnt talkbut wannatel u detail later wenwecan chat properli x
4467,ham,hey u still gym
4468,ham,said u mind go bedroom minut ok sed sexi mood came minut latr wid cake n wife
4469,ham,much better thank lol
4470,ham,noth smsing u n xy lor sorri lor da guy neva c u person sort know u lor u wan meet xy ask bring u along next meet
4471,ham,lem know swing pick free basic ani time thi semest
4472,ham,wa u effici gee thanx
4473,spam,receiv mobil content enjoy
4474,ham,abl sleep
4475,spam,want explicit sex sec ring cost pmin
4476,ham,meet soon princess ttyl
4477,ham,pick pm go taunton still want come
4478,ham,oh onli outsid player allow play know
4479,ham,anyth lor
4480,ham,erutupalam thandiyachu
4481,ham,cant u tri new invent flyi joking
4482,ham,noit ful song lyrics
4483,ham,u reckon need arrang transport u ca nt thank
4484,ham,true lov n care wil nevr go unrecogn though somon often make mistak valu definitli undrstnd onc start miss
4485,ham,shop eh ger toke abt syd leh haha
4486,ham,stand
4487,ham,good weekend
4488,ham,miss call miss call khelat kintu opponent miss call dhort lage rule one great phone receiv qualiti win
4489,ham,call get chanc plz lt
4490,ham,new deu ex game comin earli next yr
4491,ham,comput fri onli essenti part nt keep spare becaus fuck idiot roommat looovvv leav thing run full lt gt
4492,ham,friend studi warwick plan go shop concert tmw may cancel hav nt seen age yeah get togeth sometim
4493,ham,probabl coupl hour top
4494,ham,lol grins babe thank think
4495,ham,man thi bu slow think gon na get befor
4496,ham,hope thi text meet smile let thi text give reason smile beauti day
4497,ham,case wake wonder forgot take care someth grandma today done befor parad
4498,ham,ok
4499,spam,latest nokia mobil ipod mp player proze guarante repli win norcorp ltd mtmsgrcvd
4500,spam,sm servic inclus text credit pl goto wwwcomuknet login qxj unsubscrib stop extra charg help comuk cm ae
4501,ham,nvm take ur time
4502,ham,wat da decis
4503,ham,wot u bitch
4504,ham,stupidit possibl
4505,ham,told hr want post chennai becaus work
