,Type,SMS
0,ham,go jurong point crazy avail onli bugi n great world la e buffet cine got amor wat
1,ham,ok lar joke wif u oni
2,spam,free entri wkli comp win fa cup final tkt st may text fa receiv entri question std txt rate c appli
3,ham,u dun say earli hor u c alreadi say
4,ham,nah nt think goe usf live around though
5,spam,freemsg hey darl week word back like fun still tb ok xxx std chg send rcv
6,ham,even brother like speak treat like aid patent
7,ham,per request mell mell oru minnaminungint nurungu vettam ha set callertun caller press copi friend callertun
8,spam,winner valu network custom select receivea prize reward claim call claim code kl valid hour onli
9,spam,mobil month u r entitl updat latest colour mobil camera free call mobil updat co free
10,ham,gon na home soon nt want talk thi stuff anymor tonight k cri enough today
11,spam,six chanc win cash pound txt csh send cost pday day tsandc appli repli hl info
12,spam,urgent week free membership prize jackpot txt word claim c wwwdbuknet lccltd pobox ldnwarw
13,ham,search right word thank thi breather promis wont take help grant fulfil promis wonder bless time
14,ham,date sunday
15,spam,xxxmobilemovieclub use credit click wap link next txt messag click http wap xxxmobilemovieclubcom nqjkgighjjgcbl
16,ham,oh k watch
17,ham,eh u rememb spell hi name ye v naughti make v wet
18,ham,fine way u feel way gota b
19,spam,england v macedonia dont miss goalsteam news txt ur nation team eg england tri wale scotland txtú poboxoxwwq
20,ham,serious spell hi name
21,ham,go tri month ha ha onli joke
22,ham,ü pay first lar da stock comin
23,ham,aft finish lunch go str lor ard smth lor u finish ur lunch alreadi
24,ham,ffffffffff alright way meet sooner
25,ham,forc eat slice realli hungri tho thi suck mark get worri know sick turn pizza lol
26,ham,lol alway convinc
27,ham,catch bu fri egg make tea eat mom left dinner feel love
28,ham,back amp pack car let know room
29,ham,ahhh work vagu rememb doe feel like lol
30,ham,wait still clear sure sarcast whi x doe nt want live us
31,ham,yeah got wa v apologet n fallen wa actin like spoilt child got caught till wo nt go badli cheer
32,ham,k tell anyth
33,ham,fear faint housework quick cuppa
34,spam,thank subscript rington uk mobil charg month pleas confirm repli ye repli charg
35,ham,yup ok go home look time msg ü xuhui go learn nd may lesson
36,ham,oop let know roommat done
37,ham,see letter b car
38,ham,anyth lor u decid
39,ham,hello saturday go wa text see decid anyth tomo tri invit anyth
40,ham,pl go ahead watt want sure great weekend abiola
41,ham,forget tell want need crave love sweet arabian steed mmmmmm yummi
42,spam,rodger burn msg tri call repli sm free nokia mobil free camcord pleas call deliveri tomorrow
43,ham,see
44,ham,great hope like man well endow lt gt inch
45,ham,callsmessagesmiss call
46,ham,nt get hep b immunis nigeria
47,ham,fair enough anyth go
48,ham,yeah hope tyler ca nt could mayb ask around bit
49,ham,u nt know stubborn nt even want go hospit kept tell mark weak sucker hospit weak sucker
50,ham,think first time saw class
51,ham,gram usual run like lt gt half eighth smarter though get almost whole second gram lt gt
52,ham,k fyi x ha ride earli tomorrow morn crash place tonight
53,ham,wow never realiz embarass accomod thought like sinc wa best could alway seem happi cave sorri nt nt give sorri offer sorri room wa embarass
54,spam,sm ac sptv new jersey devil detroit red wing play ice hockey correct incorrect end repli end sptv
55,ham,know mallika sherawat yesterday find lt url gt
56,spam,congrat year special cinema pass call c suprman v matrix starwars etc free bxipw pm dont miss
57,ham,sorri call later meet
58,ham,tell reach
59,ham,yesgauti sehwag odi seri
60,ham,gon na pick burger way home ca nt even move pain kill
61,ham,ha ha ha good joke girl situat seeker
62,ham,part check iq
63,ham,sorri roommat took forev ok come
64,ham,ok lar doubl check wif da hair dresser alreadi said wun cut v short said cut look nice
65,spam,valu custom pleas advis follow recent review mob award bonu prize call
66,ham,today song dedic day song u dedic send thi ur valuabl frnd first rpli
67,spam,urgent ur award complimentari trip eurodisinc trav aco entry claim txt di morefrmmob shracomorsglsuplt ls aj
68,spam,hear new divorc barbi come ken stuff
69,ham,plane give thi month end
70,ham,wah lucki man save money hee
71,ham,finish class
72,ham,hi babe im home wan na someth xx
73,ham,kk perform
74,ham,u call
75,ham,wait machan call onc free
76,ham,cool gentleman treat digniti respect
77,ham,like peopl veri much veri shi pa
78,ham,doe oper lt gt
79,ham,still look job much ta earn
80,ham,sorri call later
81,ham,k call ah
82,ham,ok way home hi hi
83,ham,place man
84,ham,yup next stop
85,ham,call later nt network urgnt sm
86,ham,real u get yo onli need ticket one jacket done alreadi use multi
87,ham,ye start send request make pain came back back bed doubl coin factori got ta cash nitro
88,ham,realli still tonight babe
89,ham,ela kano il download come wen ur free
90,ham,yeah stand close tho catch someth
91,ham,sorri pain ok meet anoth night spent late afternoon casualti mean nt done ani stuffmoro includ time sheet sorri
92,ham,smile pleasur smile pain smile troubl pour like rain smile sum hurt u smile becoz someon still love see u smile
93,spam,pleas call custom servic repres ampm guarante cash prize
94,ham,havent plan buy later check alreadi lido onli got show e afternoon u finish work alreadi
95,spam,free rington wait collect simpli text password mix verifi get usher britney fml po box mk h ppw
96,ham,watch telugu moviewat abt u
97,ham,see finish load loan pay
98,ham,hi wk ok hol ye bit run forgot hairdress appoint four need get home n shower beforehand doe caus prob u
99,ham,see cup coffe anim
100,ham,pleas nt text anymor noth els say
101,ham,okay name ur price long legal wen pick u ave x xx
102,ham,still look car buy gone drive test yet
103,ham,per request mell mell oru minnaminungint nurungu vettam ha set callertun caller press copi friend callertun
104,ham,wow right nt mean guess onc gave boston men chang search locat nyc someth chang cuz signin page still say boston
105,ham,umma life vava umma love lot dear
106,ham,thank lot wish birthday thank make birthday truli memor
107,ham,aight hit get cash
108,ham,would ip address test consid comput nt minecraft server
109,ham,know grumpi old peopl mom wa like better lie alway one play joke
110,ham,dont worri guess busi
111,ham,plural noun research
112,ham,go dinnermsg
113,ham,ok wif co like tri new thing scare u dun like mah co u said loud
114,spam,gent tri contact last weekend draw show prize guarante call claim code k valid hr onli ppm
115,ham,wa ur openin sentenc veri formal anyway fine juz tt eatin much n puttin weight haha anythin special happen
116,ham,enter cabin pa said happi bday boss felt special askd lunch lunch invit apart went
117,spam,winner u special select receiv holiday flight inc speak live oper claim pmin
118,ham,goodo ye must speak friday eggpotato ratio tortilla need
119,ham,hmm uncl inform pay school directli pl buy food
120,spam,privat account statement show unredeem bonu point claim call identifi code expir
121,spam,urgent mobil wa award bonu caller prize thi final tri contact u call landlin boxwrc ppm
122,ham,new address appl pair malarki
123,spam,today voda number end select receiv award match pleas call quot claim code standard rate app
124,ham,go sao mu today done onli
125,ham,ü predict wat time ü finish buy
126,ham,good stuff
127,ham,know yetund ha nt sent money yet sent text bother send dont involv anyth nt impos anyth first place apologis
128,ham,room
129,ham,hey girl r u hope u r well del r bak long time c give call sum time lucyxx
130,ham,kk much doe cost
131,ham,home
132,ham,dear call tmorrowpl accomod
133,ham,first answer question
134,spam,sunshin quiz wkli q win top soni dvd player u know countri algarv txt ansr sp tyron
135,spam,want get laid tonight want real dog locat sent direct ur mob join uk largest dog network bt txting gravel nt eca pmsg p
136,ham,onli haf msn yiju hotmailcom
137,ham,call meet
138,ham,check room befor activ
139,spam,rcv ani msg chat svc free hardcor servic text go u get noth u must age verifi yr network tri
140,ham,got c lazi type forgot ü lect saw pouch like v nice
141,ham,k text way
142,ham,sir wait mail
143,ham,swt thought nver get tire littl thing lovabl persons cozsomtim littl thing occupi biggest part hearts gud ni
144,ham,know pl open back
145,ham,ye see ya dot
146,ham,staff name take class us
147,spam,freemsg whi nt repli text randi sexi femal live local luv hear u netcollex ltd p per msg repli stop end
148,ham,ummmawil call check inour life begin qatar pl pray veri hard
149,ham,ki delet contact whi
150,ham,sindu got job birla soft
151,ham,wine flow nevering
152,ham,yup thk cine better co need go plaza mah
153,ham,ok ur typic repli
154,ham,per request mell mell oru minnaminungint nurungu vettam ha set callertun caller press copi friend callertun
155,ham,everywher dirt floor window even shirt sometim open mouth come flow dream world without half chore time joy lot tv show ill see guess like thing must exist like rain hail mist time done becom one
156,ham,aaooooright work
157,ham,leav hous
158,ham,hello love get interview today happi good boy think miss
159,spam,custom servic annonc new year deliveri wait pleas call arrang deliveri
160,spam,winner u special select receiv cash holiday flight inc speak live oper claim
161,ham,keep safe becaus need miss alreadi envi everyon see real life
162,ham,new car hous parent onli new job hand
163,ham,love excit day spend make happi
164,spam,pl stop bootydeli f invit friend repli yes see wwwsmsacubootydeli stop send stop frnd
165,spam,bangbab ur order way u receiv servic msg download ur content u goto wap bangb tv ur mobil internetservic menu
166,ham,place ur point e cultur modul alreadi
167,spam,urgent tri contact last weekend draw show prize guarante call claim code valid hr onli
168,ham,hi frnd best way avoid missunderstd wit belov one
169,ham,great escap fanci bridg need lager see tomo
170,ham,ye complet form clark also utter wast
171,ham,sir need axi bank account bank address
172,ham,hmmm thk sure got time hop ard ya go free abt muz call u discuss liao
173,ham,time come later
174,ham,bloodi hell cant believ forgot surnam mr ill give u clue spanish begin
175,ham,well gon na finish bath good fine night
176,ham,let know got money carlo make call
177,ham,u still go mall
178,ham,turn friend stay whole show wo nt back til lt gt feel free go ahead smoke lt gt worth
179,ham,text doesnt repli let know log
180,ham,hi spoke maneesha v like know satisfi experi repli toll free ye
181,ham,lift hope offer money need especi end month approach hurt studi anyway gr weekend
182,ham,lol u trust
183,ham,ok gentleman treat digniti respect
184,ham,guy close
185,ham,go noth greatby
186,ham,hello handsom find job lazi work toward get back net mummi boytoy doe miss
187,ham,haha awesom minut
188,spam,pleas call custom servic repres freephon ampm guarante cash prize
189,ham,got xma radio time get
190,ham,ju reach home go bath first si use net tell u finish k
191,spam,uniqu enough find th august wwwareyouuniquecouk
192,ham,sorri join leagu peopl dont keep touch mean great deal friend time even great person cost great week
193,ham,hi final complet cours
194,ham,stop howev suggest stay someon abl give everi stool
195,ham,hope settl new school year wishin gr day
196,ham,gud mrng dear hav nice day
197,ham,u got person stori
198,ham,hamster dead hey tmr meet pm orchard mrt
199,ham,hi kate even hope see tomorrow bit bloodi babyjontet txt back u xxx
200,ham,found enc lt gt
201,ham,sent lt gt buck
202,ham,hello darlin ive finish colleg txt u finish u love kate xxx
203,ham,account ha refil success inr lt decim gt keralacircl prepaid account balanc rs lt decim gt transact id kr lt gt
204,ham,goodmorn sleep ga
205,ham,u call alter ok
206,ham,ü say like dat dun buy ericsson oso oredi lar
207,ham,enter cabin pa said happi bday boss felt special askd lunch lunch invit apart went
208,ham,aight yo dat straight dogg
209,ham,pleas give us connect today befor lt decim gt refund bill
210,ham,shoot big load get readi
211,ham,bruv hope great break reward semest
212,ham,home alway chat
213,ham,k k good studi well
214,ham,yup ü noe leh
215,ham,sound great home
216,ham,final match head toward draw predict
217,ham,tire nt slept well past night
218,ham,easi ah sen got select mean good
219,ham,take exam march
220,ham,yeah think use gt atm regist sure anyway help let know sure readi
221,ham,ok prob take ur time
222,ham,os call ubandu run without instal hard disk use os copi import file system give repair shop
223,ham,sorri call later
224,ham,u say leh cours noth happen lar say v romant ju bit onli lor thk e nite sceneri nice leh
225,spam,new mobil must go txt nokia collect today onli wwwtcbiz optout gbpmtmsg
226,ham,would realli appreci call need someon talk
227,spam,u meet ur dream partner soon ur career flyng start find free txt horo follow ur star sign e g horo ari
228,ham,hey compani elama po mudyadhu
229,ham,life strict teacher bcoz teacher teach lesson amp conduct exam life first conduct exam amp teach lesson happi morn
230,ham,dear good morn onli
231,ham,get gandhipuram walk cross cut road right side lt gt street road turn first right
232,ham,dear go rubber place
233,ham,sorri batteri die yeah
234,ham,ye tv alway avail work place
235,spam,text meet someon sexi today u find date even flirt u join p repli name age eg sam msg recd thirtyeight penc
236,ham,print oh lt gt come upstair
237,ham,ill littl closer like bu stop street
238,ham,wil reach
239,ham,new theori argument win situat lose person dont argu ur friend kick amp say alway correct
240,spam,u secret admir look make contact ufind rreveal think ur specialcal
241,ham,tomarrow final hear laptop case cant
242,ham,pleassssssseeeee tel v avent done sportsx
243,ham,okay shine wa meant sign sound better
244,ham,although told u dat baig face watch realli like e watch u gave co fr u thanx everyth dat u done today touch
245,ham,u nt rememb old commerci
246,ham,late said websit nt dont slipper
247,ham,ask call ok
248,ham,kalli wont bat nd inning
249,ham,didnt work oh ok goodnight ill fix readi time wake veri dearli miss good night sleep
250,spam,congratul ur award cd voucher gift guarante free entri wkli draw txt music tnc wwwldewcomwinppmxage
251,ham,ranjith cal drpd deeraj deepak min hold
252,ham,wen ur lovabl bcum angri wid u dnt take seriously coz angri childish n true way show deep affect care n luv kettoda manda nice day da
253,ham,
254,ham,day also ship compani take wk way usp take week get lag may bribe nipost get stuff
255,ham,back lem know readi
256,ham,nt necessarili expect done befor get back though becaus headin
257,ham,mmm yummi babe nice jolt suzi
258,ham,lover need
259,spam,tri contact repli offer video handset anytim network min unlimit text camcord repli call
260,ham,park next mini come today think
261,ham,yup
262,ham,anyway go shop co si done yet dun disturb u liao
263,ham,luton ring ur around h
264,spam,hey realli horni want chat see nake text hot text charg pm unsubscrib text stop
265,ham,whi dint come us
266,ham,wana plan trip sometm
267,ham,sure yet still tri get hold
268,spam,ur rington servic ha chang free credit go clubmobilescom choos content stop txt club stop pwk club po box mk wt
269,ham,evo download flash jealou
270,spam,rington club get uk singl chart mobil week choos ani top qualiti rington thi messag free charg
271,ham,come mu sort narcot situat
272,ham,night ha end anoth day morn ha come special way may smile like sunni ray leav worri blue blue bay
273,spam,hmv bonu special pound genuin hmv voucher answer easi question play send hmv info wwwpercentrealcom
274,ham,usf guess might well take car
275,ham,object bf come
276,ham,thanx
277,ham,tell rob mack hi gf theater
278,ham,awesom see bit
279,ham,sent type food like
280,ham,done hand celebr full swing yet
281,ham,got call tool
282,ham,wen u miss someon person definit special u person special whi miss keepintouch gdeve
283,ham,ok ask money far
284,ham,oki
285,ham,yeah think usual guy still pass last night get ahold anybodi let know throw
286,ham,k might come tonight class let earli
287,ham,ok
288,ham,hi babi im cruisin girl friend r u give call hour home alright fone thi fone love jenni xxx
289,ham,life mean lot becaus love life becaus love peopl life world call friend call world ge
290,ham,dear shall mail tonitebusi street shall updat toniteth look okvarunnathu edukkukaye raksha ollubut good one real sens
291,ham,hey told name gautham ah
292,ham,haf u found feel stupid da v cam wa work
293,ham,oop got bit
294,ham,thi much buzi
295,ham,accident delet messag resend pleas
296,spam,tmobil custom may claim free camera phone upgrad pay go sim card loyalti call offer end thfebt c appli
297,ham,unless situat go gurl would appropri
298,ham,hurt teas make cri end life die plz keep one rose grave say stupid miss u nice day bslvyl
299,ham,cant pick phone right pl send messag
300,ham,need coffe run tomo ca nt believ time week alreadi
301,ham,awesom rememb last time got somebodi high first time diesel v
302,ham,shit realli shock scari cant imagin second def night u think somewher could crash night save taxi
303,ham,oh way food fridg want go meal tonight
304,ham,womdarful actor
305,spam,sm ac blind date u rodds aberdeen unit kingdom check http img sm acwicmbcktzr blind date send hide
306,ham,yup remb think book
307,ham,jo ask u wana meet
308,ham,lol ye friendship hang thread caus u wo nt buy stuff
309,spam,themob check newest select content game tone gossip babe sport keep mobil fit funki text wap
310,ham,garag key nt bookshelf
311,ham,today accept dayu accept brother sister lover dear best clos lvblefrnd jstfrnd cutefrnd lifpartnr belovd swtheart bstfrnd rpli mean enemi
312,spam,think ur smart win thi week weekli quiz text play cs winnersclub po box uz gbpweek
313,ham,say give call hi friend got money definit buy befor end week
314,ham,hi way wa u day normal way thi real ur uniqu hope know u rest mylif hope u find wot wa lost
315,ham,made day great day
316,ham,kk advanc happi pongal
317,ham,hmmm guess go kb n power yoga haha dunno tahan power yoga anot thk got lo oso forgot liao
318,ham,realli dude friend afraid
319,spam,decemb onli mobil mths entitl updat latest colour camera mobil free call mobil updat co free
320,ham,coffe cake guess
321,ham,merri christma babe love ya kisses
322,ham,hey whi dont go watch x men lunch haha
323,ham,cud u tell ppl im gona b bit l co buse hav gon past co full im still waitin pete x
324,ham,would great guild could meet bristol road somewher get touch weekend plan take flight good week
325,ham,problem
326,ham,callsmessagesmiss call
327,ham,hi da today class
328,ham,say good sign well know track record read women
329,ham,cool text park
330,ham,read text sent meant joke read light
331,ham,kk apo kgood movi
332,ham,mayb could get book tomo return immedi someth
333,spam,call germani onli penc per minut call fix line via access number prepay direct access
334,ham,ani chanc might evapor soon violat privaci steal phone number employ paperwork cool pleas contact report supervisor
335,spam,valentin day special win quiz take partner trip lifetim send go pmsg rcvd custcare
336,ham,tadaaaaa home babe still
337,ham,cool come havent wine dine befor
338,ham,sleepingand surf
339,ham,sorri call later
340,ham,u call right call hand phone
341,ham,ok great thanx lot
342,ham,take post ha come must text happi read one wiv hello carolin end favourit bless
343,ham,u hide stranger
344,ham,interest like
345,ham,sister clear two round birla soft yesterday
346,ham,gudnit tc practic go
347,ham,di yiju ju saw ur mail case huim havent sent u num di num
348,ham,one small prestig problem
349,spam,fanci shag dointerest sextextukcom txt xxuk suzi txt cost per msg tnc websit x
350,ham,check realli miss see jeremiah great month
351,ham,nah ca nt help never iphon
352,ham,car hour half go apeshit
353,ham,today sorri day ever wa angri ever misbehav hurt plz plz slap urself bcoz ur fault basic good
354,ham,yo guy ever figur much need alcohol jay tri figur much safe spend weed
355,ham,lt gt ish minut wa minut ago wtf
356,ham,thank callingforgot say happi onam sirjii fine rememb met insur personmeet qatar insha allahrakhesh ex tata aig join tissco tayseer
357,spam,congratul ur award cd voucher gift guarante free entri wkli draw txt music tnc wwwldewcomwinppmxage
358,spam,ur cashbal current pound maxim ur cashin send cash onli pmsg cc hgsuiteland rowwjhl
359,ham,actor work work even sleep late sinc unemploy moment alway sleep late unemploy everi day saturday
360,ham,hello got st andrewsboy long way cold keep post
361,ham,ha ha cool cool chikku chikku db
362,ham,oh ok prob
363,ham,check audrey statu right
364,ham,busi tri finish new year look forward final meet
365,ham,good afternoon sunshin dawn day refresh happi aliv breath air smile think love alway
366,ham,well know z take care worri
367,spam,updatenow xma offer latest motorola sonyericsson nokia free bluetooth doubl min txt orang call mobileupd calloptoutfq
368,spam,discount code rp stop messag repli stop wwwregalportfoliocouk custom servic
369,ham,wat uniform get
370,ham,cool text readi
371,ham,hello boytoy geeee miss alreadi woke wish bed cuddl love
372,ham,spoil bed well
373,ham,go bath msg next lt gt min
374,ham,cant keep talk peopl sure pay agre price pl tell want realli buy much pay
375,spam,thank rington order refer charg gbp per week unsubscrib anytim call custom servic
376,ham,say happen
377,ham,could seen mei didt recognis face
378,ham,well lot thing happen lindsay new year sighs bar ptbo blue heron ha someth go
379,ham,keep payasam rinu bring
380,ham,taught ranjith sir call onli sm like becau verifi project prabu told today onli pa dont mistak
381,ham,guess whi worri must know way bodi repair quit sure nt worri take slow first test guid ovul relax noth said reason worri ill keep followin
382,ham,yeah sure give coupl minut track wallet
383,ham,hey leav big deal take care
384,ham,hey late ah meet
385,spam,doubl min txt month free bluetooth orang avail soni nokia motorola phone call mobileupd calloptoutndx
386,ham,took mr owl lick
387,ham,custom place call
388,ham,mm time dont like fun
389,spam,mth half price orang line rental latest camera phone free phone mth call mobilesdirect free updat orstoptxt
390,ham,yup lunch buffet u eat alreadi
391,ham,huh late fr dinner
392,ham,hey thi sat go intro pilat onli kickbox
393,ham,morn onli ok
394,ham,ye think offic lap room think last day didnt shut
395,ham,pick bout ish time go
396,ham,perform award calcul everi two monthnot current one month period
397,ham,wa actual sleep still might u call back text gr rock si send u text wen wake
398,ham,alway put busi put pictur ass facebook one open peopl ever met whi would think pictur room would hurt make feel violat
399,ham,good even sir al salam wahleykkumshar happi newsbi grace god got offer tayseer tissco joinedhop fineinshah allah meet sometimerakhesh visitor india
400,ham,hmmm k want chang field quickli da wan na get system administr network administrator
401,spam,free rington text first poli text get true tone help st free tone x pw e nd txt stop
402,ham,dear chechi talk
403,ham,hair cream ha ship
404,ham,none happen til get though
405,ham,yep great loxahatche xma tree burn lt gt start hour
406,ham,haha get use drive usf man know lot stoner
407,ham,wa well slightli disastr class thi pm fav darl hope day ok coffe wld good ca nt stay late tomorrow time place alway
408,ham,hello good week fanci drink someth later
409,ham,headin toward busetop
410,ham,messag text missing sender name missing number miss sent date miss miss u lot everyth miss sent via fullonsmscom
411,ham,come room point iron plan thi weekend
412,ham,co want thing
413,ham,oki go yan jiu skip ard oso go cine den go mrt one blah blah blah
414,ham,bring home wendi
415,spam,date servic cal l boxskch
416,ham,whatsup dont u want sleep
417,ham,alright new goal
418,spam,free entri weekli competit text word win c wwwtxttowincouk
419,ham,alright head minut text meet
420,spam,send logo ur lover name join heart txt love name name mobno eg love adam eve yahoo poboxwwq txtno ad p
421,ham,ye last week take live call
422,spam,someon ha contact date servic enter phone becaus fanci find call landlin poboxntfp
423,ham,siva hostel aha
424,spam,urgent mobil number ha award prize guarante call land line claim valid hr onli
425,ham,send thi ur friend receiv someth ur voic speak express childish naughti sentiment rowdi ful attitud romant shi attract funni lt gt irrit lt gt lovabl repli
426,ham,ok ok guess
427,ham,aathiwher dear
428,ham,ani pain urin ani thing els
429,ham,esplanade ü mind give lift co got car today
430,ham,wnt buy bmw car urgentlyit vri urgentbut hv shortag lt gt lacsther sourc arng di amt lt gt lacsthat prob
431,ham,home watch tv lor
432,ham,doe usual take fifteen fuck minut respond ye question
433,spam,congrat nokia video camera phone call call cost ppm ave call min vari mobil close post bcm ldn wcnxx
434,ham,book ticket pongal
435,ham,avail like right around hillsborough amp lt gt th
436,ham,messag sent askin lt gt dollar shoul pay lt gt lt gt
437,ham,ask g iouri told stori like ten time alreadi
438,ham,long doe applebe fuck take
439,ham,hi hope u get thi txtjourney hasnt gd min late think
440,ham,like love arrang
441,ham,yesh realli greatbhaji told kalli best cricket sachin world veri tough get
442,ham,suppos wake gt
443,ham,oic saw tot din c found group liao
444,ham,sorri call later
445,ham,hey hey wereth monkeespeopl say monkeyaround howdi gorgeou howu doin foundurself jobyet sausag love jen xxx
446,ham,sorri batteri die come onli get gram place
447,ham,well done blimey exercis yeah kinda rememb wot hmm
448,ham,wont get concentr dear know mind everyth
449,ham,lol made plan new year
