,Type,SMS
1358,ham,good afternoon loverboy goe day ani luck come way think sweeti send love across sea make smile happi
1359,ham,start send blackberri torch nigeria find buyer like month tell dad buy bb anyon oh
1360,ham,lt gt pple marri lover becz hav gud undrstndng dat avoid problem sent di u u wil get gud news friday person like tomorrow best day life dont break thi chain break suffer send thi lt gt frnd lt gt min whn u read
1361,ham,yo dude guess got arrest day
1362,ham,shuhui say chang suntec steamboat u noe r u
1363,ham,doe danc river
1364,ham,yetund sorri moji seem busi abl go shop pleas find way get want us get pleas forgiv repli free via yahoo messeng
1365,ham,hey realli pretti late want go lesson first join onli reach tp mrt
1366,spam,hot live fantasi call p per min ntt ltd po box croydon cr wb k
1367,ham,bbq thi sat mine ish ur welcom come
1368,ham,nt know thing wrong everyso often panick start goin bout bein good enough
1369,ham,alright good night
1370,ham,tri make anoth butt
1371,ham,hope feel great pl fill abiola
1372,ham,though shd go n fun bar town someth sound ok
1373,ham,go write msg put dictionari mode cover screen hand press lt gt gentli remov ur hand interesting
1374,spam,bear pic nick tom pete dick fact type tri gay chat photo upload call pmin stop text call
1375,spam,new mobil must go txt nokia collect today onli wwwtcbiz optout gbpmtmsg txtauction
1376,ham,final readi fyi
1377,ham,aunti huai juan never pick phone
1378,spam,doubl min doubl txt price linerent latest orang bluetooth mobil call mobileupd veri latest offer calloptoutlf
1379,ham,ya tel wat ur problem
1380,spam,nokia tone ur mob everi week txt nok st tone free get txtin tell ur friend ptone repli hl info
1381,ham,dnt wnt tlk wid u
1382,ham,spend day wait ideal path appear front us forget path made walking waiting goodnight
1383,ham,ok arm feel weak cuz got shot go anoth time
1384,ham,pleas reserv ticket saturday eve chennai thirunelvali tirunelvali chennai sunday eve alreadi see netno ticket availablei want book ticket tackl
1385,ham,storm msg wen u lift phne u say hello u knw wt real mean hello name girl yes u knw dat girl margaret hello girlfrnd f grahmbel invnt telphon moral one get name person bt hi girlfrnd g n g h
1386,ham,ok pop ask bout someth said around tonght wen thi girl come
1387,ham,e best ur exam later
1388,ham,hope ur head doe nt hurt much plough way pile iron stay chinki tonight come round like
1389,ham,oh ki think wi nz player unsold
1390,ham,haha got fast lose weight thk muz go month den got effect gee later go aust put bk e weight
1391,ham,wonder got onlin love gone net cafe get phone recharg friend net think boytoy
1392,ham,haha kid papa need drug
1393,ham,thk shld b ya wana go lesson haha go one whole stretch
1394,ham,oh ok
1395,ham,r still meet dinner tonight
1396,ham,cool gentleman treat digniti respect
1397,ham,shall start hear
1398,ham,wait u lor need feel bad lar
1399,ham,check got hi detail messag
1400,ham,regist sinco paye log icicibankcom enter urn lt gt confirm bewar fraud share disclos urn anyon
1401,ham,decid onli peopl care stuff vote care stuff loser
1402,ham,kaiez enjoy ur tuition gee thk e second option sound beta go yan jiu den msg u
1403,ham,regist sinco paye log icicibankcom enter urn lt gt confirm bewar fraud share disclos urn anyon
1404,ham,cool fun practic make babi
1405,ham,actual get readi leav hous
1406,ham,kkani special today
1407,spam,urgent import inform user today lucki day find whi log onto http wwwurawinnercom fantast surpris await
1408,ham,got ta
1409,ham,got ten buck jay noncomitt
1410,ham,hungri
1411,ham,pl speak custom machan
1412,ham,somewher beneath pale moon light someon think u dream come true goodnit amp sweet dream
1413,ham,wen ur lovabl bcum angri wid u dnt take seriously coz angri childish n true way show deep affect care n luv kettoda manda nice day da
1414,spam,dear u invit xchat thi final attempt contact u txt chat pmsgrcvdhgsuitelandsrowwjhl ldn yr
1415,ham,wat ur opinion abt abt charact
1416,ham,jay snicker tell x total fuck chord speak
1417,ham,nofew hour beforew hair cut
1418,ham,wonder co dun rem see silver car thk saw black one
1419,ham,lmao take pic send
1420,ham,speak onli feel word better silenc gud mrng
1421,ham,current scotland
1422,ham,work thi week
1423,spam,congratul ur award either cd gift voucher free entri weekli draw txt music tnc wwwldewcom winppmxage
1424,ham,lol great im get hungri
1425,ham,yes onli saw message
1426,ham,mu like lt gt second
1427,ham,ok
1428,ham,thing r good thanx got exam march ive done revis fran still boyf ive got ta interviw exet bit worri x
1429,ham,tell make littl spreadsheet track whose idea wa smoke determin smoke much entir month februari come
1430,spam,sale arsen dartboard good condit doubl trebl
1431,ham,nt look back build becaus coat nt want get sick hurri home wear coat gym
1432,ham,pain person thought alway tri keep everybodi happi time nobodi recognis alon
1433,ham,thank love wish rock
1434,ham,intrepid duo great time see soon
1435,ham,ask sen come chennai search job
1436,ham,dad went oredi
1437,ham,ju hope true missin co realli missin nt done anyth feel guilti yet
1438,ham,wat late still earli mah juz go dinner lor aiya dunno
1439,ham,arm fine cardiff uni
1440,ham,fact leav think addi goe back school tue wed
1441,ham,cool breez bright sun fresh flower twitter bird wait wish u goodmorn amp nice day
1442,ham,ya go restaurant
1443,ham,ok askd u knw tht
1444,spam,free st week entri textpod chanc win gb ipod cash everi wk txt pod ts cs wwwtextpodnet custcar
1445,ham,duck chinchilla
1446,ham,marriag function
1447,ham,look like u wil b get headstart im leav bout ish u r desper compani could head earlierw goin meet rummer
1448,ham,give fli monkey wot think certainli mind ani friend mine
1449,spam,regist optin subscrib ur draw gift voucher enter receipt correct bbc chart
1450,ham,say thanks
1451,ham,msg rajini come
1452,ham,ya ü take ure practic lesson start june
1453,ham,good becaus need drug
1454,ham,stupidit possibl
1455,ham,ü decid faster co si go home liao
1456,spam,summer final fanci chat flirt sexi singl yr area get match repli summer free join optout txt stop help
1457,ham,u sleep go take haha got spi wat onlin check n repli mail lor
1458,spam,clair havin borin time alon u wan na cum nite chat hope c u luv clair xx calls minmoremobsemspoboxpowa
1459,ham,fight world easi u either win lose bt fightng close u dificult u lose u lose u win u still lose
1460,spam,bought one rington get text cost pound offer tone etc
1461,ham,yalru lyfu astn chikku bt innu mundh lyf ali halla ke bilo marriag program edha lyf nt yet ovr chikkuali vargu lyfu meow meow
1462,ham,kinda first one get twelv aah speak tomo
1463,spam,urgent mobil xxxxxxxxx bonu caller prize thi nd attempt reach call asap
1464,ham,ok good later come find ü c lucki told ü go earlier later pple take finish ü
1465,ham,wat make u thk fall actual thk quit prone fall lucki dad home ask come n fetch alreadi
1466,spam,guarante latest nokia phone gb ipod mp player prize txt word collect tcllc nyusa pmt msgrcvd
1467,ham,account ha refil success inr lt decim gt keralacircl prepaid account balanc rs lt decim gt transact id kr lt gt
1468,ham,wont touch permiss
1469,spam,hi luci hubbi meetin day fri b alon hotel u fanci cumin pl leav msg day luci x calls minmobsmorelkpoboxhpfl
1470,ham,wonder world th th ur style th ur smile th ur person rd ur natur nd ur sm st ur love friendship good morn dear
1471,ham,take small dose tablet fever
1472,ham,oh u must taken real valentin shop first
1473,ham,sent email address incomm right
1474,ham,gon na blake night might abl get littl earli
1475,ham,friendship game play word say doesnt start march end may tomorrow yesterday today e
1476,ham,nice wait text right gon na pay ticket ya know
1477,ham,watch lotr w si di aft u wan meet dinner nite
1478,ham,whi keep away like thi
1479,ham,think far find check googl map place dorm
1480,ham,trip wa ok quit tire lor uni start today ok co take ani modul ju concentr final yr project
1481,ham,alway say welp
1482,ham,guy browsin compulsori
1483,ham,ok
1484,ham,puriti friendship two smile read forward messageit smile see name gud evng musthu
1485,ham,sorri call later
1486,ham,add nt realli care ca nt least get thi dude fuck hey money want
1487,ham,hello lover goe new job happi think wake slave send teas kiss across sea
1488,ham,told number gautham
1489,ham,tell need investig anywher
1490,ham,ok juz receive
1491,ham,cant believ said mani thing thi morn realli want say wa good morn love beauti morn see librari later
1492,spam,account ha credit free text messag activ txt word credit cs wwwbiz
1493,ham,end might still vomit okay everyth come
1494,ham,money money aint thing sha
1495,ham,ha everyth weather keep extra warm cold noth seriou pl lot vitamin c
1496,ham,hey gals anyon u go e drive centr tmr
1497,ham,alway yahoo messeng send messag ill get may send mobil mode sha ill get repli
1498,ham,put readi lt time gt
1499,ham,time n smile r two crucial thing life sometim time make us forget smile sometim someon smile make us forget time gud noon
1500,spam,sm ac jsco energi high u may know channel day ur leadership skill r strong psychic repli wquestion end repli end jsco
1501,ham,hostbas idp linux system
1502,spam,hot live fantasi call p per min ntt ltd po box croydon cr wb nation rate call
1503,ham,da plan
1504,ham,ill lt gt ok
1505,ham,oh god almost home
1506,ham,total video convert free download type thi googl search
1507,spam,thank vote sing along star karaok mobil free link repli sing
1508,ham,wen ur lovabl bcum angri wid u dnt take seriously coz angri childish n true way show deep affect care n luv kettoda manda nice day da
1509,ham,sound like someth someon test would sayi
1510,ham,u love someon dont make love u much u love much dont want love anyon except gud nit
1511,ham,pete thi phone still jenni colleg leannewhat
1512,ham,oop sorri check nt mind pick tomo half eight station would ok
1513,ham,hey sweet wa wonder moment might come want send file someon wo nt go yahoo becaus connect suck rememb set page go download format disc could tell know way download big file becaus download stuff directli internet ani help would great prey teas kiss
1514,ham,champ leav glasgow
1515,ham,k best congrat
1516,ham,wonder get thi text
1517,ham,need come home give good lovin
1518,spam,brand new mobil music servic live free music player arriv shortli instal phone brows content top artist
1519,ham,shall ask one thing dont mistak
1520,ham,check wid corect spele ie sarcasm
1521,spam,urgent mobil wa award bonu caller prize thi nd attempt contact call boxqu bt nation rate
1522,ham,angri happen dear
1523,ham,thk u dun haf hint e forum alreadi lor co told ron n darren go tell shuhui
1524,ham,yup ok thanx
1525,ham,hi ct employe
1526,ham,pl pl find aunt nike
1527,ham,wow love sooo much know bare stand wonder day goe well love think miss
1528,ham,scream mean shouting
1529,ham,hey happen de alright
1530,ham,pick receipt someth earlier
1531,ham,think chennai well settl
1532,ham,oh dang nt mean send lol
1533,ham,unfortun found pick sister airport even nt think go tri go one th
1534,ham,horribl bf v hungri
1535,ham,rememb day
1536,spam,nokia thi get win free auction take part send nokia hgsuiteland rowwjhl
1537,ham,feel mr real valentin yo valentin even tho u hardli play
1538,ham,sound good finger make difficult type
1539,ham,midnight earliest
1540,ham,sure tri make xavier smoke becaus nt want smoke told smoke much
1541,ham,k come nordstrom done
1542,ham,u konw waht rael friendship im gving yuo exmpel jsut ese tih msg evrey splle tih msg wrnog bt sitll yuo ra wihtuot ayn mitsake goodnight amp nice sleepsweet dreams
1543,ham,press confer da
1544,spam,hello orang month free access game news sport plu free text photo messag repli ye term appli wwworangecoukow
1545,ham,complet degre use join financ
1546,ham,good afternoon love ani job prospect miss lazi bleak hmmm happi fill love
1547,ham,shant disturb u anymor jia
1548,ham,bishan lar nearer need buy earli co buy got ta park car
1549,ham,dont know oh
1550,ham,dude sux snake got old raiden got buff
1551,ham,say hi get ass back south tampa prefer kegger
1552,ham,e msg ju u said thank gift
1553,ham,u
1554,ham,ok dear call chechi
1555,ham,yeah tote u wan na
1556,ham,ok found di pierr cardin one look normal cost sale
1557,ham,good sleep rhythm person ha establish rhythm bodi learn use want know
1558,ham,wat r u
1559,ham,messag truro hospit ext phone phone side
1560,ham,singl line big mean miss anyth ur best life nt miss ur best life anyth gud nyt
1561,ham,got ga money ani chanc gang want go grand natur adventur
1562,ham,dnt worri use ice piec cloth packalso take tablet
1563,ham,dude saw park car sunroof pop sux
1564,ham,get readi put excel sub face
1565,ham,tmrw im finish door
1566,ham,lt gt g saw day ago guy want sell wifi onli lt gt g lt gt whi blank
1567,ham,late
1568,ham,whatev im pretti piss
1569,ham,today accept dayu accept brother sister lover dear best clos lvblefrnd jstfrnd cutefrnd lifpartnr belovd swtheart bstfrnd rpli mean enemi
1570,ham,dont much imag class
1571,ham,got rumour go buy apart chennai
1572,ham,near kalainar tv officethenampet
1573,spam,ur cashbal current pound maxim ur cashin send go onli pmsg cc hgsuiteland rowwjhl
1574,spam,sm auction brand new nokia auction today auction free join take part txt nokia hgsuiteland rowwjhl
1575,ham,si catch e show e afternoon watch w c u wan watch today tmr lor
1576,ham,sound gd haha wah u yan jiu fast liao
1577,ham,nosi guess idk react freak
1578,ham,rememb hurt dure day satan impost mene pay price itmay destini keep go u said pray get mind get
1579,ham,make girl happi difficult make girl happi u onli need friend companion lover chef lt gt good listen lt gt organ lt gt good boyfriend lt gt veri clean lt gt sympathet lt gt athlet lt gt warm lt gt courag lt gt determin lt gt true lt gt depend lt gt intellig lt gt psychologist lt gt pest extermin lt gt psychiatrist lt gt healer lt gt stylist lt gt driver aaniy pudunga venaam
1580,ham,whi princess bet brotha chase
1581,ham,shall book chez jule half eight ok
1582,ham,hhahhaahahah rofl wtf nig wa leonardo room someth
1583,ham,yep derek hous see sunday lt
1584,ham,cool let know befor kick around lt gt day
1585,ham,sorri call later
1586,ham,wa wonder would okay call uncl john let know thing nigeria r lt gt dollar year sent know strain plan pay back everi dime give everi dime expect anyth practic someth like
1587,ham,charg transfer charg withdraw anyhow like
1588,ham,dont search love let love find u whi call fall love bcoz u dont forc u fall u know smeon hold u bslvyl
1589,ham,let go bill miller
1590,ham,love set soul fire spark flame big rawr flame xoxo
1591,ham,somewhr someon sure made u god ha decid perfect time make u meet dat person till den enjoy ur crushes
1592,ham,honeymoon outfit
1593,ham,help propos go back tomorrow
1594,spam,privat account statement show unredeem point call identifi code expir
1595,ham,never blame day ur life good day give u happi bad day give u experi essenti life god bless good morn
1596,ham,pl confirm time collect chequ
1597,spam,regist subscrib yr draw gift voucher b enter receipt correct next olymp txt
1598,spam,urgent mobil number ha award prize guarante call land line claim valid hr onli ppm
1599,ham,daddi take good care
1600,ham,yeah probabl still got ta check leo
1601,ham,kthen ani special
1602,ham,carlo take hi sweet time usual let know patti donew smoke tell haul ass
1603,ham,ok pa noth problem
1604,ham,heard job go wildlif talk tonight u wantcom thatworzel wizzl whatev
1605,ham,god pick flower dippeditinadew lovingli touch itwhichturnedinto u gift tomeandsaid thi friend u
1606,ham,came hostel
1607,ham,ok prob come lunch
1608,ham,ju tell u dat b leav shanghai st instead haf time meet cya
1609,ham,freez home yet rememb kiss mom morn love think miss yet
1610,ham,readi big day tomorrow
1611,ham,probabl around mu lot
1612,ham,
1613,spam,rtking pro video club need help info ringtonekingcouk call must club credit redeem wwwringtonekingcouk enjoy
1614,ham,thnx dude u guy nite
1615,ham,sef dey laugh meanwhil darl anji
1616,ham,mm food da
1617,ham,k make sens btw carlo difficult guy gon na smoke go pick second batch get ga
1618,ham,u download fring app
1619,ham,oz guy kinda flaki one friend interest pick lt gt worth tonight possibl
1620,ham,friend u stay fb chat
1621,ham,fuck babe miss sooooo much wish sleep bed lone go sleep dream love
1622,ham,live veri simple love also simple laugh simple win tooo simple simpl veri difficult gud nte
1623,spam,u secret admir look make contact ufind rreveal think ur specialcal
1624,ham,ah well confus thing
1625,spam,free text msg text ok credit account
1626,ham,hi dear call urgnt nt know problem nt want work ani problem least tell wate repli
1627,ham,dear ok
1628,spam,select stay top british hotel noth holiday worth claim call london bx swss
1629,ham,ye princess want make happi
1630,ham,sound like mani talent would like go dinner date next week
1631,ham,go film day da pm sorri da
1632,ham,watch movi alreadi xy want shop shop w
1633,ham,hello littl parti anim thought buzz friend grins remind love send naughti ador kiss
1634,ham,yesterday onli go home
1635,spam,eeri nokia tone u rpli tone titl eg tone dracula titl ghost addamsfa munster exorcist twilight wwwgetzedcouk poboxwwq p
1636,ham,come life brought sun shini warm heart put constant smile face make feel love care
1637,ham,shit wa nt surpris went spent even french guy met town fool around bit nt let fuck
1638,spam,network allow compani bill sm respons supplier shop ha give guarante sell b g
1639,ham,great comedyc stop laugh da
1640,spam,freemsg feelin kinda lnli hope u like keep compani jst got cam mobi wan na c pic txt repli date msgp rcv hlp stop
1641,ham,alright set text man
1642,ham,hi keen go kind feel nt go tomo nt mind
1643,ham,sleep nt feel well
1644,ham,u switch fone dammit
1645,ham,india take lead
1646,ham,ill post lr class
1647,ham,tht wat wright brother fly
1648,ham,even v good somewhat event laden fill nt worri head ok throat wreck see six
1649,ham,u laugh realli loud u talk spontaneously u dont care feel u probabl dear amp best friends goodeven dear
1650,ham,laptop take
1651,ham,dont ani file bagi wa work call mei tell find anyth room
1652,ham,wan earli lei outsid wun b home earli neva mind
1653,spam,ur chanc win cash everi wk txt action c wwwmovietriviatv custcar xpwk
1654,ham,wa bugi juz wat walk home oredi ü late repli oso saw top dat like din buy r ü
1655,ham,wish famili merri x happi new year advance
1656,ham,go ok na
1657,ham,ye post coupl pic fb still snow outsid wake
1658,ham,one good partnership go take lead
1659,spam,rgent thi nd attempt contact u u call b csbcmwcnxx callcost ppm mobilesvari max
1660,ham,yeah class
1661,ham,send bec templ na
1662,ham,nt come home class right need work shower
1663,spam,hi ur lookin sauci daytim fun wiv busti marri woman free next week chat sort time janinexx calls minmobsmorelkpoboxhpfl
1664,ham,mostli like
1665,ham,ü v fan
1666,ham,dunno co wa v late n reach insid alreadi ate spageddi lor e gal r laugh lor
1667,ham,guess spent last night phase fourth dimens
1668,ham,dad gon na call get work ask crazi question
1669,ham,yesbut said
1670,ham,veri hurt n meaning line ever compromis everyth love end love compromis everyth gud mornin
1671,ham,lmao nice
1672,ham,glad see repli
1673,spam,urgent tri contact u today draw show prize guarante call land line claim valid hr onli
1674,spam,monthli password wap mobsicom use wap phone pc
1675,ham,nah dub je still buff
1676,ham,pain words thought happi wa toughest thing earth toughest act happi unspoken pain inside
1677,ham,yeah fine get ok
1678,ham,lol u come idea
1679,ham,mani peopl seem special first sight onli veri remain special till last sight maintain till life ends sh ja
1680,ham,today song dedic day song u dedic send thi ur valuabl frnd first rpli
1681,ham,okay wait ah
1682,ham,lei
1683,ham,hi babe u r like bed im sorri tonight realli wan na see u tomorrow call love xxx
1684,ham,alreadi squat new way walk
1685,ham,want bold bb torch
1686,ham,cramp stop go back sleep
1687,spam,today vodafon number end last four digit select receiv award number match pleas call claim award
1688,spam,free top rington sub weekli ringtoneget st week freesend subpoli per weekstop sms
1689,ham,nan sonathaya soladha whi boss
1690,ham,bring tat cd forget
1691,spam,sunshin quiz wkli q win top soni dvd player u know countri algarv txt ansr sp tyron
1692,ham,nt know rape dude poker
1693,ham,weightloss girl friend make load money ebay someth give thank god
1694,ham,wa gr see messag r u leav congrat dear school wat r ur plan
1695,ham,ü eatin later eatin wif fren lei ü go home first
1696,ham,finish alreadi yar keep say mushi embarrass ok
1697,ham,sorri man stash ran dri last night ca nt pick sunday
1698,ham,hai priya right doctor said pa
1699,spam,free msg sorri servic order could deliv suffici credit pleas top receiv servic
1700,ham,ok
1701,ham,pleas ask mummi call father
1702,ham,come room come hous co hous still messi haha
1703,ham,lost kilo today
1704,ham,tast fish curri p
1705,ham,might accid tookplac somewher ghodbandar rd traffic move slove plz slip amp nt worri
1706,ham,yun ahnow ü wkg btw ü go nu sc ü wana specialis wad
1707,ham,ye one woman man pleas tell like dislik bed
1708,ham,wa test earlier appreci call tomorrow
1709,ham,loverboy doe keep come hi queen hmmm doe nt ach speak miss despar
1710,ham,u meet fren dun wan meet ah muz b guy rite
1711,ham,promis though nt even gotten dinner yet
1712,ham,got back ani dislik bed
1713,ham,turn stereo love mi phone unknown album
1714,spam,hard live chat pmin choos girl connect live call cheap chat uk biggest live servic vu bcmwcnxx
1715,ham,yeah nt see whi
1716,ham,ask u knw nt may ur frnd classmat
1717,ham,sorri earlier put firesar around talk actual life lol
1718,spam,wow boy r back take uk tour win vip ticket prebook vip club txt club trackmarqu ltd info vipclubu
1719,ham,missionari hook doggi hook stand
1720,ham,u better go sleep dun disturb u liao u wake msg lor
1721,ham,fight world easi u either win lose bt fightng close u dificult u lose u lose u win u still lose
1722,ham,watch hous veri entertain get whole hugh lauri thing even stick inde especi stick
1723,ham,thought prap meant anoth one goodo look tomorrow
1724,ham,hi jon pete ive bin spain recent hav sum dinero left bill said u ur rent mayb interest hav pe around tb jame
1725,ham,bold lt gt
1726,ham,know shall speak lt gt minut
1727,ham,alrit hunni wot u nite didnt end goin town ju da pub instead ju chillin da mo bedroom love jen xxx
1728,ham,went project centr
1729,ham,per request maangalyam alaipayuth ha set callertun caller press copi friend callertun
1730,ham,lol yeah thi point guess
1731,ham,project w fren lor
1732,ham,lol well qualiti aint bad aint complain
1733,ham,k happen tonight
1734,spam,hi thi mandi sullivan call hotmix fm chosen receiv easter prize draw pleas telephon claim befor prize transfer someon els
1735,ham,think go finn come
1736,ham,whi tire special
1737,ham,come tomorrow di
1738,ham,cant pick phone right pl send messag
1739,ham,k go sleep well take rest
1740,ham,u guy never invit anywher
1741,spam,ur go bahama callfreefon speak live oper claim either bahama cruis cash onli opt txt x
1742,ham,want pleas insid outsid bedroom
1743,ham,ey calm downon theacusations itxt u co iwana know wotu r doin thewend haventcn u agesr ur neth satlov j xxx
1744,ham,love wine dine ladi
1745,spam,someon ha conact date servic enter phone becaus fanci find call landlin poboxntf
1746,ham,cool ta luv vtire caus doin load plan wk got social servic inspect nurseri take care spk sn x
1747,ham,know account detailsi ask mom send youmi mom reach
1748,ham,think u wrong number
1749,ham,feel alway happy slowli becom habit amp final becom part life follow happi morn amp happi day
1750,ham,b late love mum
1751,ham,got itmail panren paru
1752,ham,wa think chuckin ur red green n black trainner save carryin bac train
1753,ham,give one miss number pleas
1754,ham,ju came back fr lunch wif si onli u leh
1755,ham,schedul next week town thi weekend
1756,ham,realli good dhanush rock onc
1757,ham,lmao ok wont need u hair anymor
1758,ham,miss ya need ya want ya love ya
1759,ham,sorri free
1760,ham,u ever get song stuck head reason wo nt go away til u listen like time
1761,ham,nt yet chikkusimpl habbahw abt u
1762,ham,got ur mail dileepthank muchand look forward lot support veri less contact rememb one venugop mentionedtomorrow late shall tri come till theregoodnight dear
1763,ham,sometim heart remembr someon veri much forget someon soon bcoz heart like everyon like one rememb everytim bslvyl
1764,ham,joy father john john name joy father mandan
1765,spam,hi ibh custom loyalti offer new nokia mobil onli txtauction txt word start get
1766,ham,hi thi yiju regard textbook intro algorithm second edit sell
1767,spam,sm auction nokia thi get win free auction take part send nokia hgsuiteland rowwjhl
1768,ham,k want us come
1769,ham,littl difficult simpl way enter thi place
1770,ham,ha us e thing got tv watch u thk go tonight u alreadi haf smth mind
1771,ham,dont show far put new pictur facebook
1772,ham,watch tv got new job
1773,ham,good afternoon sexi bun goe job search wake first thought alway love wish fine happi know ador
1774,ham,come whatev want
1775,ham,ok chikku favourit song
1776,ham,u see post facebook
1777,spam,call freephon
1778,spam,buy space invad chanc win orig arcad game consol press game arcad std wap charg see ocoukgam term set purchas
1779,ham,wonder world th th ur style th ur smile th ur person rd ur natur nd ur sm st ur love friendship good morn dear
1780,spam,loan ani purpos homeown tenant welcom previous refus still help call free text back help
1781,spam,big brother alert comput ha select u k cash voucher call ntt po box cro bt landlin cost ppm mobil vari
1782,ham,oh well c u later
